question,domain
Will Russian Chess Player Sergey Karjakin be removed or withdraw from the FIDE 2022 Candidates Tournament?,Sports
NBA: Will the Lakers beat the Kings by more than 7.5 points in their November 26th matchup?,Sports
(NBA) Bucks in six?,Sports
"NHL: Will the Oilers beat the Sharks by more than 1.5 goals in their April 28, 9:00 PM ET matchup?",Sports
Will the top song on Spotify Charts hit 32M global streams for the week ending on February 17?,Arts & Recreation
"Will Trump win any of Pennsylvania, Arizona or Georgia?",Politics & Governance
NHL: Will the Oilers beat the Red Wings by more than 1.5 goals in their March 15 matchup (9 PM ET)?,Sports
"Will at least 99% of U.S. COVID-19 cases be from the Omicron variant on January 1, 2022?",Healthcare & Biology
"NBA: Will the Bucks beat the Timberwolves by more than 3.5 points in their March 19, 5:10 PM ET matchup?",Sports
NBA: Will the Suns beat the Pelicans by more than 10.5 points in their April 17 (9 PM ET) matchup?,Sports
Will Khabib win his UFC 254 Fight?,Sports
Will Hikaru Nakamura get 9 or more points in the preliminaries of the FTX Crypto Cup?,Sports
Will the Otherdeed floor price be above 3.5 ETH on June 6?,Economics & Business
TEST: EXCITING AND NEW EDITION,DROP
"Will the 7-day COVID-19 Case average in the USA be above 500,000 on February 1, 2022?",Healthcare & Biology
"Will the floor price of Bored Apes be above 79 ETH on February 1st, 2022?",Economics & Business
"Will @Snowden tweet again by May 1, 2022?",Politics & Governance
"NHL: Will the Wild beat the Flames by more than 1.5 goals in their April 28, 8:00 PM ET matchup?",Sports
Will the top song on Spotify Charts hit 30.5M global streams for the week ending on March 24?,Arts & Recreation
"Will the floor price of CryptoPunks be above 50 ETH on February 1st, 2022?",Economics & Business
NBA: Will the Memphis Grizzlies' current winning streak end with 12 or 13 games in a row?,Sports
NBA: Will the Suns beat the Knicks by more than 6.5 points in their March 4 (10 PM ET) matchup?,Sports
"NHL: Will the Lightning beat the Blackhawks by more than 1.5 goals in their April 1, 7:00 PM ET matchup?",Sports
Will the Netherlands be the Group C winner in the Euro 2020?,Sports
NHL: Will the Panthers beat the Canucks by more than 1.5 points in their January 21 matchup?,Sports
NBA: Will the Mavericks beat the Pelicans by more than 8.5 points in their November 8th matchup?,Sports
Will the James Webb telescope be launched successfully before Christmas?,Science & Tech
NHL: Will the Maple Leafs beat the Canadiens by more than 2.5 goals in their April 9 matchup (7 PM ET)?,Sports
"NHL: Will the Canucks beat the Knights by more than 1.5 goals in their April 3, 7:00 PM ET matchup?",Sports
Will Jake Paul win his boxing match against Nate Robinson?,Sports
Will Chelsea London win the 2021-22 English Premier League?,Sports
"Will Bored Ape Yacht Club (BAYC) flip CryptoPunks by January 10, 2022?",Economics & Business
"Will the US hit its highest recorded gas price per gallon according to AAA by March 15, 2022?",Economics & Business
Will Argentina win the 2021 Copa America?,Sports
Oscars 2022: Will any film win 6 or more awards?,Arts & Recreation
"Will at least 90% of U.S. COVID-19 cases be from the Omicron variant on January 1, 2022?",Healthcare & Biology
Will it snow in New Yorks' Central Park on the New Year's Eve (Dec 31)?,Science & Tech
NFL: Will the Chiefs beat the Packers by more than 6.5 points in their November 7th matchup?,Sports
Will the winning margin of the 2021 Tour de France be less than 1 minute?,Sports
Will Founders Fund invest in the next announced Onlyfans fundraising round in 2021?,Economics & Business
NHL: Will the Lightning beat the Bruins by more than 1.5 goals in their April 8 matchup (7 PM ET)?,Sports
Will Real Madrid win 2021-22 La Liga?,Sports
NBA: Will the Nuggets beat the Clippers by more than 7.5 points in their January 19 matchup?,Sports
Will Sherrilyn Ifill be the next nominee for Supreme Court Justice?,Politics & Governance
"Will the floor price of Mutant Apes be above 7 ETH on February 1st, 2022?",Economics & Business
NBA: Will the Celtics beat the Nets by more than 5.5 points in their February 8 (7.30 PM ET) matchup?,Sports
"Will Facebook be online at midnight ET, October 5th?",Science & Tech
NFL: Will the Saints beat the Falcons by more than 5.5 points in their November 7th matchup?,Sports
Will Arsenal beat Bournemouth?,Sports
NHL: Will the Flames beat the Canucks by more than 1.5 goals in their January 29 matchup (10 PM ET)?,Sports
"NBA: Will the Mavericks beat the Wizards by more than 8.5 points in their April 1, 7:10 PM ET matchup?",Sports
NBA: Will the Warriors beat the Nets by more than 6.5 points in their January 29 (8.30 PM ET) matchup?,Sports
NFL: Will the Bears beat the Lions by more than 2.5 points in their November 25th matchup?,Sports
"Will President Biden visit Ukraine by June 1, 2022?",Politics & Governance
Will more than 2.25 million people travel through a TSA checkpoint on any day between Dec. 23 and Dec. 31?,Security & Defenses
"NHL: Will the Panthers beat the Wings by more than 2.5 goals in their April 21, 7:00 PM ET matchup?",Sports
"NHL: Will the Stars beat the Coyotes by more than 2.5 goals in their April 27, 8:30 PM ET matchup?",Sports
"Will EIP-1559 be implemented live on Ethereum mainnet by 8:45 AM ET on August 5, 2021?",Science & Tech
"NHL: Will the Kings beat the Kraken by more than 1.5 goals in their March 28, 10:30 PM ET matchup?",Sports
"Will there be more than 140 million confirmed COVID-19 cases globally by April 20, 2021?",Healthcare & Biology
NBA: Will the Knicks beat the Pacers by more than 3.5 points in their January 4 matchup?,Sports
Will Jeff Koons' “Pancakes” sell for more than $1.5 million at Sotheby’s?,Arts & Recreation
538: Will voters prefer Republicans over Democrats by Election Day?,Politics & Governance
Will Joe Biden's FiveThirtyEight approval rating be 43% or higher on September 29?,Politics & Governance
Will Liz Truss remain Prime Minister of the United Kingdom through 2022?,Politics & Governance
Will 'Thor: Love and Thunder' get a 75% or higher Tomatometer Score?,Arts & Recreation
NBA: Will the 76ers beat the Magic by more than 11.5 points in their January 19 matchup?,Sports
NBA: Will the Warriors beat the Pacers by more than 4.5 points in their December 13 matchup?,Sports
Will there be a variant that overtakes Omicron in the US by February 15th?,Healthcare & Biology
"Will a vacancy for the US Supreme Court be announced by September 1, 2021?",Politics & Governance
NHL: Will the Canucks beat the Kraken by more than 1.5 goals in their February 21 matchup (10 PM ET)?,Sports
Will Joe Biden's FiveThirtyEight approval rating be 42% or higher on Election Day?,Politics & Governance
Will Lebron James play against the New York Knicks on Tuesday?,Sports
Will the floor price of Ryder Ripps BAYC (RR/BAYC) be above 1 ETH on June 30?,Economics & Business
Will the floor price of CryptoPunks be above 52 ETH on May 26?,Economics & Business
Will Drake drop his album on time?,Arts & Recreation
Will Messi score a goal on his PSG debut?,Sports
Will the 49ers beat the Raiders by more than 5.5 points in their NFL preseason matchup?,Sports
Will Squid Game remain the #1 Netflix show in the US throughout the ‘second week’ of October?,Arts & Recreation
NBA: Will the 76ers beat the Heat by more than 4.5 points in their December 15 matchup?,Sports
Will 'Archive 81' be the #1 Netflix show worldwide on the week ending January 30?,Arts & Recreation
Will the Brooklyn Nets win the NBA ‘21-’22 Championship?,Sports
NBA: Will the Pelicans beat the Thunder by more than 1.5 points in their December 26 matchup?,Sports
"Will @Whale_Alert tweet count be over 61,300 on January 31 (10 AM ET)?",Arts & Recreation
NBA: Will the Heat beat the 76ers by more than 2.5 points in their January 15 matchup?,Sports
Will $BTC break $20k before 2021?,Economics & Business
"Will the floor price of CryptoPunks be above 75 ETH on December 23, 2021?",Economics & Business
Will Trump be present for Joe Biden’s Inauguration?,Politics & Governance
Will Andy Warhol's Self Portrait sell for more than $16 million at Sotheby's?,Arts & Recreation
"NHL: Will the Kings beat the Ducks by more than 1.5 goals in their April 19, 10:00 PM ET matchup?",Sports
Will Allyson Felix win a medal in the Women’s 400M?,Sports
"NHL: Will the Panthers beat the Jets by more than 1.5 goals in their April 15, 7:00 PM ET matchup?",Sports
NHL: Will the Lightning beat the Red Wings by more than 1.5 goals in their March 4 matchup (7 PM ET)?,Sports
NBA: Will the Grizzlies beat the Thunder by more than 8.5 points in their December 2 matchup?,Sports
NBA: Will the Knicks beat the Lakers by more than 4.5 points in their November 23rd matchup?,Sports
"NHL: Will the Avalanche beat the Oilers by more than 1.5 goals in their April 22, 9:00 PM ET matchup?",Sports
NBA: Will the Hawks beat the Pistons by more than 4.5 points in their March 23 (7 PM ET) matchup?,Sports
Will Joe Biden's RCP job approval rating on January 21 be between 41.9% and 42.1%?,Politics & Governance
NBA: Will the Nuggets beat the Kings by more than 4.5 points in their February 24 (10 PM ET) matchup?,Sports
"Will Polygon ($MATIC) be $1.80 or higher on January 31, 2022?",Economics & Business
"Will Hashmasks be the highest volume NFT category by 7-day volume on February 25, 2021?",Arts & Recreation
NBA: Will the Rockets beat the Magic by more than 2.5 points in their December 3 matchup?,Sports
Will 'Minions: The Rise of Gru' gross more than $75 million domestically on its opening weekend?,Arts & Recreation
NBA: Will the 76ers beat the Hornets by more than 5.5 points in their January 12 matchup?,Sports
NFL: Will the Dolphins beat the Jets by more than 3.5 points in their November 21st matchup?,Sports
Will the Raptors beat the Magic by more than 8.5 points in their October 29th matchup?,Sports
"NHL: Will the Blues beat the Knights by more than 1.5 goals in their April 29, 8:00 PM ET matchup?",Sports
(In-game Trading) Will the Suns beat the Nuggets by more than 6.5 points in their October 20th matchup?,Sports
redeemall test 19,DROP
NBA: Will the Cavaliers beat the Magic by more than 9.5 points in their November 27th matchup?,Sports
NFL: Will the Rams beat the Seahawks by more than 9.5 points in their December 21 matchup?,Sports
Will Coco Gauff win Women's US Open?,Sports
"Will Joan Miro's ""Peinture poème” (Lot 71C) sell for more than $12m at Christie’s on November 11?",Arts & Recreation
Will Shiba Inu ($SHIB) reach market cap of $50 billion at any point on or before November 15th?,Economics & Business
"NHL: Will the Capitals beat the Stars by more than 1.5 goals in their March 20, 5:00 PM ET matchup?",Sports
"NHL: Will the Capitals beat the Leafs by more than 1.5 goals in their April 24, 7:00 PM ET matchup?",Sports
redeemall test 1,DROP
Will the U-3 unemployment rate in January be above 4.2%?,Economics & Business
"NHL: Will the Capitals beat the Coyotes by more than 2.5 goals in their April 22, 10:30 PM ET matchup?",Sports
NHL: Will the Golden Knights beat the Kings by more than 1.5 goals in their February 18 matchup (10 PM ET)?,Sports
Will there be fewer than 300K daily COVID cases in India by May 20?,Healthcare & Biology
NBA: Will the Mavericks beat the Pacers by more than 9.5 points in their January 29 (7 PM ET) matchup?,Sports
NFL: Will the Buccaneers beat the Falcons by more than 12.5 points in their December 5 matchup?,Sports
"Will ETH be above $1,500 on January 27th?",Economics & Business
NBA: Will the Pelicans beat the Clippers by more than 3.5 points in their January 13 matchup?,Sports
NBA: Will the Pelicans beat the Trail Blazers by more than 1.5 points in their December 21 matchup?,Sports
Will Steve Scalise be the next Speaker?,Politics & Governance
Will daily atmospheric CO2 be above 416 ppm on Christmas Eve?,Science & Tech
NHL: Will the Hurricanes beat the Senators by more than 1.5 points in their December 2 matchup?,Sports
Will the 76ers beat the Pelicans by more than 4.5 points in their October 20th matchup?,Sports
image url test 4,DROP
"Will Vice President Harris cast a tie-breaking vote by May 15, 2021?",Politics & Governance
Will Joe Biden's RCP job approval rating on January 21 be between 41.6% and 41.8%?,Politics & Governance
NHL: Will the Blackhawks beat the Ducks by more than 1.5 goals in their January 15 matchup?,Sports
"Will 3 or more of Dan Ariely’s papers be retracted by December 31, 2021?",Education & Research
"Will the US have a higher COVID-19 Case Average per capita than France, Italy, and Spain on March 1st?",Healthcare & Biology
NBA: Will the Jazz beat the Knicks by more than 6.5 points in their February 7 (10 PM ET) matchup?,Sports
NFL: Will the Cardinals beat the Bears by more than 6.5 points in their December 5 matchup?,Sports
auto-resolve test 5,DROP
NBA: Will the Bulls beat the Hawks by more than 1.5 points in their March 3 (7 PM ET) matchup?,Sports
Will Sergey Lavrov and Antony Blinken meet in February 2022?,Politics & Governance
"NHL: Will the Blackhawks beat the Coyotes by more than 1.5 goals in their April 20, 10:00 PM ET matchup?",Sports
"Will Coinbase’s NFT marketplace be live by July 1st, 2022?",Economics & Business
NBA: Will the Heat beat the Spurs by more than 3.5 points in their February 3 (8.30 PM ET) matchup?,Sports
auto-resolve test 6,DROP
Will MrBeast's Squid Game video reach 60M views in its first week?,Arts & Recreation
Biden v. Nebraska: Student Loan Forgiveness,Politics & Governance
Erdoğan >93¢ on May 26?,Politics & Governance
NBA: Will the Heat beat the Mavericks by more than 3.5 points in their February 15 (7.30 PM ET) matchup?,Sports
Will 'The Flash' gross over $85m on opening weekend?,Arts & Recreation
NBA: Will the Mavericks beat the Kings by more than 7.5 points in their March 5 (5 PM ET) matchup?,Sports
"Will Trump mention ""Joe/Joseph Biden"" 5 or more times during his CNN town hall?",Politics & Governance
Will Ding Liren win the 2023 Superbet Chess Classic?,Sports
Will FTX relaunch by June 30?,Economics & Business
Mohamed Deif still in Hamas leadership through March 1?,Politics & Governance
Will 140 or more House Republicans vote for the debt ceiling deal by June 4?,Politics & Governance
Will 'Elemental' gross over $37.5m on opening weekend?,Arts & Recreation
"Will Trump mention ""Ron DeSantis"" 5 or more times during his CNN town hall?",Politics & Governance
NYC AQI >200 PM2.5 by July 10?,Science & Tech
"Will $BTC reach $32,500 by July 14?",Economics & Business
Will ≥10% of Votes go to 3rd Party Candidates in the 2024 US Presidential Election?,Politics & Governance
Putin to remain President of Russia through June?,Politics & Governance
NFL: Will the Vikings beat the Lions by more than 7.5 points in their December 5 matchup?,Sports
"ETH above $1,900 on June 2?",Economics & Business
Will Trump be indicted a second time by June 30?,Politics & Governance
"archWill $ETH (Ethereum) be above $4,500 on December 19, 12pm ET?",Economics & Business
Will the Jacksonville Jaguars win Super Bowl LVIII?,Sports
Will the SEC approve BlackRock's Bitcoin ETF by August 31?,Economics & Business
Will U.S. inflation be greater than 0.2% from March to April 2023?,Economics & Business
archWill NASA have confirmed more than 4580 existing exoplanets by December 21?,Science & Tech
Turkish 2nd round turnout over 87%?,Politics & Governance
Any hostage deal brokered with Hamas by Nov 1?,Politics & Governance
Will 'Blue Beetle' gross over $27m opening weekend?,Arts & Recreation
Will 'Money Heist: Part 5' be the #1 Netflix show worldwide on the week ending December 19?,Arts & Recreation
archWill Boris Johnson be the prime minister of the United Kingdom on January 14?,Politics & Governance
Will 'Oppenheimer' gross over $50m on opening weekend?,Arts & Recreation
Will SBF plead guilty by August 21?,Politics & Governance
Will AOC win the 2024 US Presidential Election?,Politics & Governance
Will Remilia's stolen funds be returned this month?,Economics & Business
Turkish Presidential Margin of Victory >5%?,Politics & Governance
Bitcoin ETF doesn't get approval by Jan 15?,Economics & Business
NBA: Will the Hornets beat the Rockets by more than 5.5 points in their November 27th matchup?,Sports
Will the Indianapolis Colts win the AFC South?,Sports
Texans vs. Colts: Margin of Victory 3-6?,Sports
Instacart market cap >20b?,Economics & Business
Will the Hurricanes be the 2023 NHL Champion?,Sports
Will the Heat beat the Pacers by more than 4.5 points in their October 23rd matchup?,Sports
Alien contact in 2023?,Science & Tech
Will Young Thug's new album have over 140k sales in its first week?,Arts & Recreation
Will Sweden join NATO by January 31?,Politics & Governance
Damian Lillard traded before start of season?,Sports
Balaji Bet: BTC > $1m USD on June 17?,Economics & Business
Trump heavier than 260 lbs?,Politics & Governance
Will Fabiano Caruana win 2023 Norway Chess?,Sports
Will Libya hold national elections in 2023?,Politics & Governance
"Will anyone say ""George Santos"" in the 4th RNC primary debate?",Politics & Governance
Will Syriza win >31% of votes in the Greek election? (first round),Politics & Governance
Will KKE win over 7% of votes?,Politics & Governance
"Will ""Biden"" be said by every candidate in the 2nd RNC primary debate?",Politics & Governance
"ETH above $1,750 on May 13?",Economics & Business
"Will Hunter Biden be indicted by July 1, 2023?",Politics & Governance
Will Newcastle finish in the Premier League Top 4 for the 2022/23 season?,Sports
NBA: Will the Bucks beat the Knicks by more than 4.5 points in their November 5th matchup?,Sports
Will 'Spider-Man: Across the Spider-Verse' gross over $100 million on opening weekend?,Arts & Recreation
Will 'The Flash' gross over $100m on opening weekend?,Arts & Recreation
"ETH above $1,900 on May 31?",Economics & Business
Will Sweden win Eurovision 2023?,Arts & Recreation
Will Trump be indicted a third time by June 30?,Politics & Governance
US debt ceiling hike by July 1?,Economics & Business
NBA: Will the Pelicans beat the Pistons by more than 5.5 points in their December 10 matchup?,Sports
Will it rain in Central Park on Monday June 5th 2023?,Science & Tech
"ETH above $1,800 on May 21?",Economics & Business
Will Helen Gym win the 2023 Philadelphia mayoral Democratic primary?,Politics & Governance
Will George Santos remain in Congress through June 30?,Politics & Governance
Will SAG end strike by Oct 31?,Arts & Recreation
Will Peter Obi be elected as President of Nigeria in the upcoming 2023 Presidential Election?,Politics & Governance
TEST Will it rain in Prospect Park on Sunday June 11th?,Science & Tech
Will Netherlands win the 2023 Women's World Cup?,Sports
Will U.S. inflation be greater than 0.1% from March to April 2023?,Economics & Business
Argentina Presidential Election: Will Javier Milei win?,Politics & Governance
"Will Trump say ""rape"" during his CNN town hall?",Politics & Governance
Will Olivia Chow win the 2023 Toronto mayoral by-election?,Politics & Governance
Will the Lucknow Super Giants win IPL 2023?,Sports
Will Israel regain control of all territory by Oct 8?,Politics & Governance
Will the Grizzlies beat the Heat by more than 2.5 points in their October 30th matchup?,Sports
Will Zuck answer the door?,DROP
Will Ian Nepomniachtchi win the 2023 Superbet Chess Classic?,Sports
"Will 'Avatar: The Way of Water' gross more than $650 million domestically by January 31, 2023?",Arts & Recreation
Will Ukraine win Eurovision 2023?,Arts & Recreation
Will Cosmos (ATOM) price be above $40 at noon on January 11?,Economics & Business
"Will ""Israel"" be said 15 or more times in the 3rd RNC primary debate?",Politics & Governance
Will Messi score in his next game?,Sports
Will NSC win a plurality in the 2023 Dutch General Election?,Politics & Governance
Will 'Fast X' gross more than $75 million domestically on its opening weekend?,Arts & Recreation
Will Kamala Harris win the popular vote in the 2024 Presidential Election?,Politics & Governance
Will Google announce 1000+ new layoffs before February?,Economics & Business
Will Jimmy Butler win the 2023 NBA Finals MVP?,Sports
Will Kari Lake be the next Speaker?,Politics & Governance
Will the Nuggets sweep the Heat?,Sports
Will Neymar leave PSG?,Sports
Will Snoop smoke again in 2023?,Arts & Recreation
Will President Biden speak for longer than 1 hour at his Joint Address?,Politics & Governance
Will @kanyewest tweet again in 2022?,Arts & Recreation
Will Biden visit Israel by end of week?,Politics & Governance
Will MEXC become insolvent by July 3?,Economics & Business
Will the Fed increase interest rates by 25 bps after its June meeting?,Economics & Business
Will Australia win the 2023 Women's World Cup?,Sports
Will the price of ETH on Uniswap be greater than 1880 USDC on the Uniswap 5bps pair at 12:30pm EST on Sunday June 4th 2023?,Economics & Business
arcWill 'Blue Beetle' gross over $13m this weekend?,Arts & Recreation
"Will DeSantis say ""Abortion"" during his Twitter Space?",Politics & Governance
Will @realDonaldTrump tweet by July 15?  ,Politics & Governance
arcWill 'Barbie' gross over $16m this weekend?,Arts & Recreation
Putin to remain President of Russia through Monday?,Politics & Governance
Will Trump say a racial slur before February?,Politics & Governance
Will the Fed increase interest rates by 50 bps after its June meeting?,Economics & Business
Will Trump receive a gag order by October 15?,Politics & Governance
US debt ceiling hike by June 3?,Economics & Business
"Will @elonmusk have between 29,050-29,064 tweets on August 8?",Arts & Recreation
Formula 1: Will Red Bull collect the most points of any constructor at the 2023 Austrian Grand Prix?,Sports
Will a major hurricane make landfall in the US in September?,Science & Tech
(OLD MARKET - See new market) Will Donald Trump be the 2024 Republican presidential nominee?,Politics & Governance
 Will Trump mention DeSantis more than Biden during his CNN town hall?,Politics & Governance
Will Coinbase list $PEPE by May 31?,Economics & Business
Is water wet?,Science & Tech
whew,DROP
Will Brazil win the 2023 Women's World Cup?,Sports
2023 Singaporean presidential election: Will Ng Kok Song win?,Politics & Governance
RNC Debate: Will DeSantis speak the most?,Politics & Governance
NBA: Will the Knicks beat the Rockets by more than 11.5 points in their November 20th matchup?,Sports
"Will the bipartisan infrastructure bill become law by Noon, November 15, 2021?",Politics & Governance
NBA: Will the Trail Blazers beat the Rockets by more than 6.5 points in their November 12th matchup?,Sports
NBA: Will the Jazz beat the Kings by more than 7.5 points in their November 20th matchup?,Sports
Will LeBron announce his retirement by May 31?,Sports
"Drake's 'For All the Dogs"" over 400k sales week 1?",Arts & Recreation
"Will Joe Biden be President of the United States on August 1, 2023?",Politics & Governance
Will the government shutdown last more than 10 days?,Politics & Governance
Which party will control the U.S. Senate after the 2024 election?,Politics & Governance
Will EIP-4844 be implemented by EOY?,Science & Tech
Will U.S. inflation be greater than 0.4% from March to April 2023?,Economics & Business
"ETH above $1,800 on May 26?",Economics & Business
Will Drake's album drop on 9/22?,Arts & Recreation
Will Lukas Matsson be CEO at the end of Succession S4?,Arts & Recreation
Will Volodymyr Zelenskyy remain President of Ukraine through June 30?,Politics & Governance
Will SpaceX's Starship reach outer space by April 30?,Science & Tech
"Will DeSantis say ""A.I."" and/or ""Artificial Intelligence"" during his Twitter Space?",Politics & Governance
"ETH above $2,000 on July 7?",Economics & Business
Did Israeli intelligence have advanced knowledge of the Attack?,Security & Defenses
Will Adin Ross interview Kim Jong Un on stream by Saturday?,Politics & Governance
Will Luton Town win a Premier League game this year?,Sports
arch Will unverified Twitter users be able to see more than 1k posts per day by July 10?,Science & Tech
Will Macron remain President of France through July 10?,Politics & Governance
Will Ron DeSantis win the 2024 Republican Iowa Caucus?,Politics & Governance
"Will ""Ukraine"" be said 10 or more times in the 3rd RNC primary debate?",Politics & Governance
"Will ""Biden"" be said by every candidate in the 3rd RNC primary debate?",Politics & Governance
"Will DeSantis say ""Crypto"" and/or ""Cryptocurrency"" during his Twitter Space?",Politics & Governance
Will the Mavericks beat the Spurs by more than 6.5 points in their October 28th matchup?,Sports
Will President Biden mention Donald Trump in his first Joint Address?,Politics & Governance
Will N.D. win >35% of votes the Greek election? (first round),Politics & Governance
Will Elon and Zuck announce a fight?,Arts & Recreation
Will Roman Roy be CEO at the end of Succession S4?,Arts & Recreation
New Ye music this year?,Arts & Recreation
"Will Donald Trump be President of the USA on January 31, 2024?",Politics & Governance
"Will ""Hamas"" be said 15 or more times in the 3rd RNC primary debate?",Politics & Governance
Will another company be the largest company in the world on January 31?,Economics & Business
Will the price of $ETH be above $1500 on November 4?,Economics & Business
Will the Hamas x Israel ceasefire last the full 4 days?,Politics & Governance
Will Saudi Aramco be the largest company in the world on January 31?,Economics & Business
NBA: Will the Heat beat the Magic by more than 4.5 points in their December 17 matchup?,Sports
Will Brighton finish in the Premier League Top 4 for the 2022/23 season?,Sports
Will Trump's mugshot be released by June 30?,Politics & Governance
Will James Harden be traded?,Sports
Will Microsoft be the largest company in the world on January 31?,Economics & Business
Sally Kornbluth still MIT President by end of 2023?,Education & Research
