question,domain
redeemall test 16,DROP
"NBA: Will the Nuggets beat the Cavaliers by more than 2.5 points in their March 18, 7:40 PM ET matchup?",Sports
NBA: Will the Timberwolves beat the Spurs by more than 8.5 points in their April 7 (8 PM ET) matchup?,Sports
"NCAAB: Will the Duke Blue Devils beat the Michigan St Spartans by more than 6.5 points in their March 20, 5:15 PM ET matchup?",Sports
"NHL: Will the Jets beat the Kings by more than 1.5 goals in their April 2, 7:00 PM ET matchup?",Sports
"qqqWill Ukraine become a European Union candidate country by July 31, 2022?",Politics & Governance
"NBA: Will the Raptors beat the Lakers by more than 8.5 points in their March 18, 7:40 PM ET matchup?",Sports
"Will the price of a barrel of crude oil be $100 or more on July 18, 2022?",Economics & Business
Will the Fed increase interest rates by 0 bps after its May meeting?,Economics & Business
"Will SpaceX's Starship successfully reach outer space by December 31, 2022?",Science & Tech
Will the Bitcoin ($BTC) Market Cap be above $1 trillion on December 25?,Economics & Business
Will Frank Ocean play Coachella Weekend 2?,Arts & Recreation
Will Charles Leclerc finish 2nd in the 2022 F1 driver standings?,Sports
"ETH above $2,000 on May 6?",Economics & Business
NBA: Will the Raptors beat the Lakers by more than 2.5 points in their March 14 (10.30 PM ET) matchup?,Sports
"Will Kevin Paffrath be Governor of California on December 31, 2021?",Politics & Governance
NBA: Will the Suns beat the Cavaliers by more than 6.5 points in their 24th November matchup?,Sports
NBA: Will the Celtics beat the Hornets by more than 4.5 points in their January 19 matchup?,Sports
"Will ETH be above $1500 on March 7th, 2021?",Economics & Business
NHL: Will the Blue Jackets beat the Sabres by more than 1.5 goals in their February 20 matchup (6 PM ET)?,Sports
NBA: Will the Clippers beat the Kings by more than 11.5 points in their April 9 (9:30 PM ET) matchup?,Sports
NHL: Will the Wild beat the Jets by more than 1.5 goals in their February 8 matchup (8 PM ET)?,Sports
NHL: Will the Stars beat the Coyotes by more than 1.5 goals in their February 20 matchup (7 PM ET)?,Sports
NBA: Will the Mavericks beat the Hawks by more than 2.5 points in their February 6 (6 PM ET) matchup?,Sports
FIDE World Chess Grand Prix 2022 Leg #2: Will Anish Giri win Pool B?,Sports
Will Jake Paul win his boxing match against Ben Askren?,Sports
NBA: Will the Hawks beat the Rockets by more than 11.5 points in their December 13 matchup?,Sports
archNFL: Will the Rams beat the Jaguars by more than 15.5 points in their December 12 matchup?,Sports
Will Trump post on Threads by July 31?,Politics & Governance
NBA: Will the Grizzlies beat the Wizards by more than 5.5 points in their January 29 (8 PM ET) matchup?,Sports
NBA: Will the Nets beat the Pistons by more than 8.5 points in their December 12 matchup?,Sports
Will the floor price of Mutant Apes be above 25 ETH on February 17?,Economics & Business
Golf: Will Collin Morikawa win the 2022 Masters Tournament?,Sports
"NBA: Will the Bucks beat the Bulls by more than 2.5 points in their April 22, 8:30 PM ET matchup?",Sports
Will annual inflation in the European Union be 8.8% or more in May?,Economics & Business
Will PASOK win over 12% of votes?,Politics & Governance
"Will Binance Coin (BNB) have a higher market cap than Ethereum (ETH) at any time before July 1, 2021?",Economics & Business
ARCHNBA: Will the  beat the  by more than  points in their November 26th matchup?,Sports
"Will Kanye West’s album DONDA be released by August 7, 2021?",Arts & Recreation
Will it reach 65°F in Tucson on January 9th 2022?,Science & Tech
Will the New York Yankees win the AL East?5f57321f,Sports
"NHL: Will the Rangers beat the Islanders by more than 1.5 goals in their April 1, 7:00 PM ET matchup?",Sports
"NHL: Will the Leafs beat the Lightning by more than 1.5 goals in their May 4, 7:30 PM ET matchup?",Sports
Will the Floyd Mayweather and Logan Paul exhibition match go the distance?,Sports
Blur airdrop by Nov 20?,Economics & Business
"NHL: Will the Flames beat the Blues by more than 1.5 goals in their April 2, 10:00 PM ET matchup?",Sports
"archWill Bitcoin (BTC) price be above $40,000 at noon on January 31 2022?",Economics & Business
Will the Patriots beat the Saints by more than 2.5 points in their week three matchup?,Sports
"Will $BNB (Binance Coin) be above $350 on June 15, 2021?",Economics & Business
NHL: Will the Sabres beat the Canadiens by more than 1.5 goals in their February 12 matchup (12.30 PM ET)?,Sports
Will U.S. inflation be more than 0.5% from June to July 2022?,Economics & Business
Will 18 million Americans have received at least one 'booster shot' of the COVID-19 vaccine by November 4th?,Healthcare & Biology
"NBA: Will the Jazz beat the Warriors by more than 1.5 points in their April 2, 8:30 PM ET matchup?",Sports
Will Princeton University remain the highest ranking national university in the US according to US News?,Education & Research
"NBA: Will the Raptors beat the Heat by more than 3.5 points in their April 3, 7:10 PM ET matchup?",Sports
"NBA: Will the Raptors beat the Magic by more than 9.5 points in their April 1, 7:10 PM ET matchup?",Sports
"NHL: Will the Rangers beat the Flyers by more than 1.5 goals in their April 3, 7:00 PM ET matchup?",Sports
FIDE World Chess Grand Prix 2022: Will Levon Aronian win Leg #1?,Sports
Will Pete Buttigieg be confirmed to a Cabinet position by Mar. 1?,Politics & Governance
ddNBA: Will the Clippers beat the Grizzlies by more than 1.5 points in their November 18th matchup?,Sports
"Will ETH be above $1500 on March 22nd, 2021?",Economics & Business
NHL: Will the Wild beat the Islanders by more than 1.5 goals in their Jan 30 matchup (7.30 PM ET)?,Sports
ewrweCsan we werewresolve this with a mult sig?swerwe,DROP
"Will the bipartisan infrastructure bill become law by November 19, 2021?",Politics & Governance
"Will a barrel of crude oil close at $100 or more on May 4, 2022?",Economics & Business
archWill the price of $ETH be higher or lower 1 week post-merge?,Economics & Business
NBA: Will the Bulls beat the Nets by more than 2.5 points in their January 12 matchup?,Sports
"NBA: Will the Mavericks beat the Timberwolves by more than 3.5 points in their March 21, 8:40 PM ET matchup?",Sports
"Will $UST be above $0.90 on May 17, 2022?",Economics & Business
Will U.S. inflation be more than 0.7% from June to July 2022?,Economics & Business
Will the Patriots beat the Giants by more than 3 points in their NFL preseason matchup?,Sports
"Will the price of $BTC be above $33,000 on February 1st, 2022?",Economics & Business
"archwrongparaWill the price of wheat close above $1200 on March 25, 2022?",Economics & Business
"NHL: Will the Leafs beat the Senators by more than 1.5 goals in their April 16, 7:00 PM ET matchup?",Sports
archWill there be an earthquake of magnitude 4.5 or higher in the conterminous U.S. in March 2022?,Science & Tech
Will Germany be the Group F winner in the Euro 2020?,Sports
NBA: Will the Kings beat the Pistons by more than 4.5 points in their November 15th matchup?,Sports
Will the US win Bronze in Curling at the 2022 Winter Olympics?,Sports
NHL: Will the Panthers beat the Capitals by more than 1.5 goals in their May 11 matchup (7:30 PM ET)?,Sports
NBA: Will the Bucks beat the Hornets by more than 8.5 points in their December 1 matchup?,Sports
NBA: Will the Kings beat the Rockets by more than 5.5 points in their January 14 matchup?,Sports
Will Newsom get at least 54% support in his recall election?,Politics & Governance
NFL: Will the Bills beat the Colts by more than 7.5 points in their November 21st matchup?,Sports
redeemall test 10,DROP
Will the Jazz beat the Thunder by more than 12.5 points in their October 20th matchup?,Sports
NFL: Will the Falcons beat the Lions by more than 5.5 points in their December 26 matchup?,Sports
"Will Kanye West’s album DONDA be released by midnight ET, August 9, 2021?",Arts & Recreation
Will LeBron say COVID vaccine could've caused Bronny's cardiac arrest?,Healthcare & Biology
Will Ed Ruscha's “Ripe” (Lot 37C) sell for more than $22m at Christie’s on November 11?,Arts & Recreation
archNBA: Will the Bucks beat the Knicks by more than 4.5 points in their December 12 matchup?,Sports
"Will the price of wheat close above $1050 on April 29, 2022?",Economics & Business
Formula 1: Will 15 or more drivers complete the 2022 Miami Grand Prix?,Sports
Will Joan Miró’s “Femme (Femme debout)” sell for more than $10 million at Christie’s?,Arts & Recreation
"NBA: Will the Jazz beat the Mavericks by more than 6.5 points in their April 21, 9:00 PM ET matchup?",Sports
arcNHL: Will the Ducks beat the Canadiens by more than 1.5 goals in their January 27 matchup? (7 PM ET)?,Sports
NBA: Will the Bulls beat the Knicks by more than 2.5 points in their December 2 matchup?,Sports
archWill NASA successfully launch the Space Launch System (SLS) into space by September 5th?,Science & Tech
Will Saudi Arabia win the 2022 World Cup?,Sports
"NHL: Will the Jackets beat the Senators by more than 1.5 goals in their April 22, 7:00 PM ET matchup?",Sports
F1: Will there be a McLaren or a Ferrari car in the top 3 of the Qatar Grand Prix?,Sports
"NBA: Will the Warriors beat the Wizards by more than 7.5 points in their March 27, 6:10 PM ET matchup?",Sports
redeem all test 9,DROP
"Will Pope Francis visit Ukraine by May 13, 2022?",Politics & Governance
"Will Mitch McConnell vote to convict Trump on impeachment by April 29, 2021?",Politics & Governance
Will an ENS domain sell for more than 1.55m by October 31st?,Economics & Business
NBA: Will the Bulls beat the 76ers by more than 3.5 points in their November 6th matchup?,Sports
"archWill 'Envolver' by Anitta be the #1 song on the Spotify Global Charts any day by April 14, 2022?",Arts & Recreation
2/15 test 5,DROP
"Will the floor price of Bored Apes be over 100 ETH on February 25, 2022?",Economics & Business
"Will there be more than 5 million Ukrainian refugees by April 30, 2022?",Politics & Governance
Will BTC break $15k before 2021?,Economics & Business
Will ‘Top Gun: Maverick’ gross $130 million or more on the 4-day Memorial Weekend domestically?,Arts & Recreation
archWill Vladimir Putin be a defendant of the ICC before 2023?,Politics & Governance
ddNFL: Will the Rockets beat the Thunder by more than 2.5 points in their November 29th matchup?,Sports
"NCAAB: Will the VMI Keydets beat the UNC Wilmington Seahawks by more than 0.5 points in their March 20, 12:00 PM ET matchup?",Sports
"NCAAB: Will the Kansas Jayhawks beat the Miami Hurricanes by more than 5.5 points in their March 27, 2:20 PM ET matchup?",Sports
NHL: Will the Rangers beat the Coyotes by more than 1.5 goals in their January 22 matchup?,Sports
ddNFL: Will the Eagles beat the Saints by more than 2.5 points in their November 21 matchup?,Sports
DDNBA: Will the Lakers beat the Pistons by more than 7.5 points in their November 21 matchup?,Sports
ddNFL: Will the Bulls beat the Hornets by more than 5.5 points in their November 29th matchup?,Sports
archNBA: Will the Celtics beat the Blazers by more than 7.5 points in their January 21 matchup?,Sports
test 3 question for new dev listener,DROP
Will a 2nd monkeypox case be reported in the US by August 1?,Healthcare & Biology
"Will Joe Biden sign a reconciliation bill with a CBO score over $2.5 Trillion Dollars by December 31st, 2021?",Politics & Governance
"Will ETH be above $1750 on March 7th, 2021?",Economics & Business
will.this.work.now????????,DROP
"holdWill Matcha airdrop a native token by March 31st, 2022?",Economics & Business
archWill Novak Djokovic compete in the 2023 Australian Open?,Sports
test oracle scalar,Science & Tech
Will Liz Truss be the next UK Conservative Party Leader?,Politics & Governance
WRONG FEE: Will Serena Williams win the 2021 Wimbledon?,Sports
NBA: Will the Lakers beat the Spurs by more than 2.5 points in their November 14th matchup?,Sports
archWill the 2022 World Cup winner be from Europe?,Sports
archNFL: Will the Buccaneers beat the Falcons by more than 12.5 points in their December 12 matchup?,Sports
"arcWill the price of a barrel of crude oil be $87.50 or more on October 24, 2022? (NOV 2022 Future)",Economics & Business
Will 'Eternals' get 85% or higher Audience Score on Rotten Tomatoes?,Arts & Recreation
Will Bitcoin ($BTC) break $100k in 2021?,Economics & Business
ddNFL: Will the Heat beat the Nuggets by more than 7.5 points in their November 29th matchup?,Sports
ddNFL: Will the Clippers beat the Pelicans by more than 8.5 points in their November 29th matchup?,Sports
Will Bianca Andreescu win the 2021 Wimbledon?,Sports
"NBA: Will the 76ers beat the Mavericks by more than 2.5 points in their March 18, 7:10 PM ET matchup?",Sports
"NHL: Will the Capitals beat the Devils by more than 1.5 goals in their March 26, 7:00 PM ET matchup?",Sports
gaserrWill the Tampa Bay Buccaneers win the NFC South?,Sports
archNFL: Will the Buccaneers beat the Eagles by more than 8.5 points in their January 16 matchup?,Sports
ddNBA: Will the Bucks beat the Hornets by more tNBA: Will the Mavericks beat the Pelicans by more than 3.5 points in their December 1 matchup?han 8.5 points in their December 1 matchup?,Sports
"NCAAB: Will the Texas A&M Aggies beat the Xavier Musketeers by more than 4.5 points in their March 31, 7:00 PM ET matchup?",Sports
Will more than 2.10 million people travel through a TSA checkpoint on any day between Jan. 1 and Jan. 11?,Security & Defenses
"aaaaWill any Russian institution be disconnected from SWIFT by April 1, 2022?",Economics & Business
archWill Neutrino USD (USDN) fall below 50 cents by July 30?,Economics & Business
"archWill OpenAI release GPT-4 before August 1, 2022?",Science & Tech
Will payment for order-flow be illegal before 2022?04b0d558,Economics & Business
archWill Tyson Fury KO/TKO/RTD Dillian Whyte?,Sports
"NBA: Will the Cavaliers beat the Bulls by more than 1.5 points in their March 26, 8:10 PM ET matchup?",Sports
NBA: Will the Suns beat the Warriors by more than 2.5 points in their November 30th matchup?,Sports
NBA: Will the Heat beat the Trail Blazers by more than 8.5 points in their January 19 matchup?,Sports
Will the New York Rangers win the NHL 2021-22 Stanley Cup?,Sports
Will Donald Trump receive 232 electoral college votes?,Politics & Governance
Will the floor price of CryptoPunks be above 75 ETH on January 13?,Economics & Business
Will Novak Djokovic compete in the 2022 Australian Open?,Sports
NBA: Will the Cavaliers beat the Hawks by more than 1.5 points in their February 15 (7.30 PM ET) matchup?,Sports
Will Joe Biden's FiveThirtyEight approval rating be 42.3% or less on January 26?,Politics & Governance
Will Brazil win the 2021 Copa America?,Sports
NHL: Will the Bruins beat the Hurricanes by more than 1.5 goals in their January 18 matchup?,Sports
Will CryptoPunks flip Bored Ape Yacht Club (BAYC) by August 1?,Economics & Business
Will $BTC dip below $25k before April 1st?,Economics & Business
"Will Vitalik Buterin have a CryptoPunk Twitter profile picture before September 1, 2021?",Economics & Business
Will FTX's deal with BlockFi be announced by July 31?,Economics & Business
Will Roy Lichtenstein’s “Interior: Perfect Pitcher” sell for more than $30 million at Christie’s?,Arts & Recreation
NBA: Will the Mavericks beat the Clippers by more than 6.5 points in their February 12 (8.30 PM ET) matchup?,Sports
"Will there be more than 219 million fully vaccinated people in the USA on March 1, 2022?",Healthcare & Biology
Will 'Jurassic World Dominion' get a 70% or higher Tomatometer Score?,Arts & Recreation
Will there be an earthquake of magnitude 4.5 or higher in conterminous U.S. by November 29th?,Science & Tech
"Will Volodymyr Zelenskyy be President of Ukraine on April 22, 2022?",Politics & Governance
Will a single person become Time's 2021 Person of the Year?,Politics & Governance
Will the US have fewer than 1000 COVID-19 cases on any day on or before September 1?,Healthcare & Biology
NFL: Will the Titans beat the Jaguars by more than 8.5 points in their December 12 matchup?,Sports
NBA: Will the Jazz beat the Pacers by more than 9.5 points in their November 11th matchup?,Sports
archPremier League: Who will win the Manchester Utd v. West Ham game on January 22?,Sports
NBA: Will the Grizzlies beat the Timberwolves by more than 4.5 points in their January 13 matchup?,Sports
Will the price of Wolf Game Wool ($WOOL) be above 10 cents at noon on December 1st?,Economics & Business
Will any NBA Conference Semifinal Series go to a Game 7?,Sports
"aaaWill there be a named tropical system (storm, hurricane) Alex that forms by May 31, 2022?",Science & Tech
Will it be possible to shop on Amazon using Bitcoin in the US before 2022?,Economics & Business
NFL: Will the Chargers beat the Steelers by more than 8.5 points in their November 21 matchup?,Sports
archWill Larva Lab’s 104 Cryptopunks sell for $25M or more at Sotheby’s?,Economics & Business
Will the NYC Democratic mayoral first round leader also win the primary?,Politics & Governance
Will Poland qualify from Group C?,Sports
redeem all test 8,DROP
redeem all test 6,DROP
Will Jane Timken win the Republican nomination for the 2022 United States Senate election in Ohio?,Politics & Governance
"Will Vice President Harris cast another tie-breaking vote by July 15, 2021?",Politics & Governance
NBA: Will the Lakers beat the Pacers by more than 4.5 points in their January 19 matchup?,Sports
NBA: Will the Bulls beat the Pacers by more than 1.5 points in their February 4 (7 PM ET) matchup?,Sports
is this thing on?,DROP
Will NASA conduct a sustained flight of Ingenuity on Mars by April 12?,Science & Tech
Golf: Will Jordan Spieth win the 2022 Masters Tournament?,Sports
image url test 3,DROP
Will Kanye West release 'Donda 2' (or another new album) by 2/22/22?,Arts & Recreation
(In-Game Trading) Will the USA beat Australia by 10 or more points in the Men's Basketball Tokyo 2020 Olympic Semifinals match?,Sports
World Cup: Saturday - Will Netherlands beat USA?,Sports
Formula One: Will Max Verstappen finish ahead of Lewis Hamilton in the Mexican Grand Prix?,Sports
"Will Donald Trump file to run for president before June 1, 2021?",Politics & Governance
"NBA: Will the Celtics beat the Bucks by more than 4.5 points in their May 1, 1:00 PM ET matchup?",Sports
"Will Tayler Holder KO, TKO, or retire AnEsonGib?",Sports
NFL: Will the 49ers beat the Bears by more than 3.5 points in their October 31st matchup?,Sports
NFL: Will the Chiefs beat the Steelers by more than 8.5 points in their December 26 matchup?,Sports
Will 'Morbius' gross $50 million or more on opening weekend in the USA?,Arts & Recreation
Explosion at Zaporizhzhia nuclear plant by July 31?,Security & Defenses
Will the floor price of Azuki be 26 ETH or more on May 15?,Economics & Business
NBA: Will the Bucks beat the Bulls by more than 8.5 points in their April 17 (6:30 PM ET) matchup?,Sports
NHL: Will the Senators beat the Sabres by more than 1.5 goals in their January 18 matchup?,Sports
Will Maya Wiley win second place in the 2021 NYC Democratic Primary?,Politics & Governance
NBA: Will the 76ers beat the Pistons by more than 6.5 points in their November 4th matchup?,Sports
NFL: Will the Titans beat the Saints by more than 2.5 points in their November 14th matchup?,Sports
"Will Melania Trump file for divorce before March 16th, 2021? ",Politics & Governance
"NBA: Will the Heat beat the 76ers by more than 3.5 points in their May 10, 7:30 PM ET matchup?",Sports
"Will the price of Bitcoin (BTC) be above $46,000 on April 14?",Economics & Business
redeemall test 2,DROP
Formula 1: Will there be 2 or more safety cars at the 2022 Azerbaijan Grand Prix?,Sports
Will Hikaru Nakamura win 2 or more times during his May 24 FTX Crypto Cup preliminary games?,Sports
Will Boris Johnson remain Prime Minister of the United Kingdom through August?,Politics & Governance
Will Ketanji Brown Jackson be the next nominee for Supreme Court Justice?,Politics & Governance
NHL: Will the Senators beat the Devils by more than 1.5 goals in their February 7 matchup (7 PM ET)?,Sports
NCAA: Will the Gonzaga Bulldogs win March Madness 2022?,Sports
NBA: Will the Raptors beat the Pistons by more than 8.5 points in their November 13th matchup?,Sports
auto-resolve test 1,DROP
NHL: Will the Islanders beat the Coyotes by more than 1.5 points in their January 21 matchup?,Sports
"NBA: Will the Bucks beat the Celtics by more than 5.5 points in their April 7, 7:30 PM ET matchup?",Sports
"Will Cozy Finance airdrop a native token by March 31st, 2022?",Economics & Business
Will we get this to work by the end of the night?,DROP
"Will the floor price of CryptoPunks be above 80 ETH on December 23, 2021?",Economics & Business
Will weekly jobless claims exceed 650K for the week ending on April 3?,Economics & Business
"archWill the top 3 players of tennis ATP Ranking be Djokovic, Medvedev, Zverev on November 30th?",Sports
NBA: Will the Heat beat the Hawks by more than 6.5 points in their April 17 (3:30 PM ET) matchup?,Sports
NBA: Will the Jazz beat the Trail Blazers by more than 17.5 points in their April 10 (9:30 PM ET) matchup?,Sports
NHL: Will the Avalanche beat the Coyotes by more than 1.5 goals in their February 1 matchup (9 PM ET)?,Sports
NFL: Will the Buccaneers beat the Saints by more than 10.5 points in their December 19 matchup?,Sports
"Will anyone say ""alien"" in the 2nd RNC primary debate?",Politics & Governance
Will Joe Biden’s approval rating be higher than his disapproval rating on any day in 2022?,Politics & Governance
"arcWill Curve suffer an exploit by March 31, 2022?",Security & Defenses
Will Joe Biden's FiveThirtyEight approval rating be 41.0% or higher on August 31?,Politics & Governance
Will the Fed increase interest rates by 100 bps after their September meeting?,Economics & Business
Will Jair Bolsonaro win 2022 Presidential Elections in Brazil?,Politics & Governance
"Will zkSync have a token by May 1st, 2022?",Science & Tech
NFL: Will the Eagles beat the Giants by more than 4.5 points in their November 28th matchup?,Sports
Will a hurricane make landfall in the lower 48 U.S. states by August 31?,Science & Tech
"Will Doug Jones be the Senate-confirmed Attorney General on March 1, 2021?",Politics & Governance
Will the floor price of Bored Apes be 70 ETH or above on Aug 31?,Economics & Business
redeemall test 3,DROP
"holdWill Connext airdrop a native token by March 31st, 2022?",Economics & Business
NBA: Will the Pacers beat the Heat by more than 2.5 points in their December 21 matchup?,Sports
Will the FTX Crypto Cup preliminary game between Magnus Carlsen and Alireza Firouzja end in a draw?,Sports
redeem all test 10,DROP
"NBA: Will the Warriors beat the Spurs by more than 6.5 points in their March 20, 8:30 PM ET matchup?",Sports
2022 NFL Draft: Will Ahmad Gardner be in the top 4 picks?,Sports
"NBA: Will the Hawks beat the Warriors by more than 2.5 points in their March 25, 7:40 PM ET matchup?",Sports
Will Total Cryptocurrency Market Cap reach $2.5 trillion by May 10?,Economics & Business
"DEPOLYTEST NHL: Will the Wild beat the Jackets by more than 1 points in their March 11, 7:00 PM ET matchup?",Sports
ddNFL: Will the Browns beat the Lions by more than 13.5 points in their November 21 matchup?,Sports
Parlay: US Bitcoin Spot and ETH Futures ETF this year?,Economics & Business
Will Marjorie Taylor Greene sit on the House Education Committee on March 1?,Politics & Governance
"NCAAB: Will the Houston Cougars beat the Illinois Fighting Illini by more than 4.5 points in their March 20, 12:10 PM ET matchup?",Sports
"NBA: Will the Knicks beat the Magic by more than 4.5 points in their April 3, 6:10 PM ET matchup?",Sports
"NCAAB: Will the Duke Blue Devils beat the North Carolina Tar Heels by more than 4.5 points in their April 2, 8:49 PM ET matchup?",Sports
archWill the top song on Spotify Charts hit 32M global streams for the week ending on February 17?,Arts & Recreation
NBA: Will the Timberwolves beat the Pacers by more than 6.5 points in their February 12 (3 PM ET) matchup?,Sports
"NHL: Will the Penguins beat the Wings by more than 1.5 goals in their March 27, 5:00 PM ET matchup?",Sports
"Will Nancy Pelosi, Hillary Clinton, Bill Clinton, or Hunter Biden be charged with a federal crime by October 1?b0e16f57",Politics & Governance
Will Jim Jordan be appointed to the January 6 Select Committee by Aug. 1?,Politics & Governance
ddNFL: Will the Dolphins beat the Jets by more than 3.5 points in their November 21 matchup?,Sports
ARCHWill the floor price of CryptoPunks be above 55 ETH on January 13?,Economics & Business
"NBA: Will the Heat beat the Thunder by more than 15.5 points in their March 18, 8:10 PM ET matchup?",Sports
"NCAAB: Will the USC Trojans beat the Miami Hurricanes by more than 2.5 points in their March 18, 3:10 PM ET matchup?",Sports
NBA: Will the Celtics beat the Hawks by more than 6.5 points in their February 12 (5 PM ET) matchup?,Sports
archNBA: Will the Hawks beat the Cavaliers by more than 4.5 points in their December 19 matchup?a,Sports
2/15 test 2,DROP
not happy test,DROP
Will Poland's ambassador to Russia be recalled or expelled by March 24?,Politics & Governance
Will Pak’s Sotheby’s auction generate more than $69M in total sales?,Arts & Recreation
"WRONG: Will Lloyd Austin by Secretary of Defense on October 1, 2021?",Politics & Governance
Will payment for order-flow be illegal before 2022?,Economics & Business
Will President Biden say “Trump” during his August 16 speech + Q&A?6257becc,Politics & Governance
"Will Uniswap V3 be live on Arbitrum by September 15, 2021?",Science & Tech
Will Kourtney Kardashian and Travis Barker publicly get engaged by November 29th?,Arts & Recreation
NBA: Will the Cavaliers beat the Heat by more than 5.5 points in their December 13 matchup?,Sports
Will inflation be 0.6% or more from June to July?,Economics & Business
