question,domain
Will Dean Phillips win the U.S. Democratic presidential nomination? (negative risk),Politics & Governance
Will Kamala Harris win the U.S. 2024 Democratic presidential nomination? (negative risk),Politics & Governance
Will Hillary Clinton win the U.S. 2024 Democratic presidential nomination? (negative risk),Politics & Governance
Will Michelle Obama win the U.S. 2024 Democratic presidential nomination? (negative risk),Politics & Governance
NYT drop OpenAI case by March?,Science & Tech
"archWill Coinbase support Polygon USDC deposits and withdrawals by April 30, 2022?",Economics & Business
North Korea missile test by October 15?,Security & Defenses
Tensor airdrop by March 1?,Science & Tech
Will Israel officially state they were subject to a cyber attack on October 7th?,Security & Defenses
Will Egypt open its border for Palestinian refugees by Oct 20?,Politics & Governance
"Will anyone say ""Bitcoin"" in the 2nd RNC primary debate?",Politics & Governance
Will Kevin McCarthy resign from the House in 2023?,Politics & Governance
US troops in Israel/Palestine by October 31?,Security & Defenses
OpenAI board out by end of week?,Science & Tech
Will Joe Biden's 538 disapproval rating be greater than 55.5% on December 29?,Politics & Governance
"$BTC price between $45,000-47,500 1 hour after ETF approval?",Economics & Business
"Will the price of natural gas be $5.50 or more on October 31, 2022? (DEC 2022 Future)",Economics & Business
Will Philadelphia 76ers be champions of the 2023-24 NBA season?,Sports
Will New York Knicks be champions of the 2023-24 NBA season?,Sports
Sam Altman CEO of a different company in 2023?,Economics & Business
Iceland volcanic eruption by Nov 15?,Science & Tech
"Will ""Ukraine"" be said 8 or more times in the 4th RNC primary debate?",Politics & Governance
Will Egypt open its border for Palestinian refugees by Nov 1?,Politics & Governance
"Will anyone say ""alien"" in the 4th RNC primary debate?",Politics & Governance
Sam Altman criminal charges by Nov 30?,Politics & Governance
Will SEC delay Bitcoin ETF decision?,Economics & Business
Another Tesla recall before July?,Science & Tech
Will Donald Trump win the 2024 US Presidential Election?,Politics & Governance
Will Ron DeSantis win the New Hampshire Republican Primary?,Politics & Governance
Will Hamas release 20+ hostages in a single day by Nov 15?,Politics & Governance
Will Ron DeSantis win the U.S. 2024 Republican presidential nomination?,Politics & Governance
Will the Hamas x Israel ceasefire last 8 days?,Politics & Governance
Will Sam Altman tweet by Sunday?,DROP
Will Haley win the Iowa Caucus?,Politics & Governance
Will the final global heat increase be 1.18 or greater for 2023?,Science & Tech
Will 'Tears of the Kingdom' win Game of the Year?,Arts & Recreation
Will Toronto Raptors be champions of the 2023-24 NBA season?,Sports
Will the vote to oust McCarthy have a margin of 15-50?,Politics & Governance
Hunter Biden arrested before April?,Politics & Governance
Will Chicago Bulls be champions of the 2023-24 NBA season?,Sports
arch Will Jonathan Taylor play this week? Now,Sports
Will Putin be reelected?,Politics & Governance
2024 presidential election: Democrats win by 65-104,Politics & Governance
OpenSea token >1 billion a week after launch?,Economics & Business
Another Israel x Hamas ceasefire by Jan 15?,Politics & Governance
Will 'The Marvels' gross more than $45 million domestically on its opening weekend?,Arts & Recreation
Will SpaceX's 3rd Starship go higher than its prior launch before April?,Science & Tech
Will Salah join a Saudi club next transfer window?,Sports
Will Tim Scott win the 2024 Republican presidential nomination?,Politics & Governance
Will VVD win a plurality in the 2023 Dutch General Election?,Politics & Governance
Will the New Orleans Saints win Super Bowl LVIII?,Sports
Taylor Swift pregnant before March?,Arts & Recreation
2024 presidential election: GOP wins by 65-104,Politics & Governance
Will Detroit Pistons be champions of the 2023-24 NBA season?,Sports
Will Cleveland Cavaliers be champions of the 2023-24 NBA season?,Sports
Will Azerbaijan invade Armenia by Nov 30?,Politics & Governance
archHamas still holding hostages through end of 2023?,Politics & Governance
Will Ramaswamy place 2nd in the 2024 Iowa Caucus?,Politics & Governance
Will the Suez Canal close in 2023?,Economics & Business
Will the Poloniex hacker return the stolen funds by Nov 17?,Security & Defenses
arch Who will crowdfund more money: Police or Nahel?,DROP
Will Israel invade Lebanon by January 20?,Politics & Governance
Will Milwaukee Bucks be champions of the 2023-24 NBA season?,Sports
Will Atlanta Hawks be champions of the 2023-24 NBA season?,Sports
Will Indiana Pacers be champions of the 2023-24 NBA season?,Sports
Will Draymond Green be suspended for 10+ games?,Sports
Will CZ remain CEO of Binance through 2023?,Economics & Business
Will Charlotte Hornets be champions of the 2023-24 NBA season?,Sports
Will the US confirm that aliens exist by June?,Science & Tech
Will Trump be Speaker by Mar 1?,Politics & Governance
USDC market cap over $25 billion EOY?,Economics & Business
Will Mike Pence win the U.S. 2024 Republican presidential nomination?,Politics & Governance
Saudi and Israel peace deal by March 2024?,Politics & Governance
'Dune 2' bigger opening weekend than 'Dune'?,Arts & Recreation
Binance insolvent in 2023?,Economics & Business
Will the Hamas x Israel ceasefire last 10 days?,Politics & Governance
Jonathan Taylor to play this week?,Sports
Will there be 21+ named storms during the Atlantic Hurricane Season?,Science & Tech
Will there be a Senate vacancy in Pennsylvania by EOY?,Politics & Governance
Liz Magill still UPenn President by end of 2023?,Education & Research
Will 'Wonka' gross over $40m over its opening weekend?,Arts & Recreation
zkSync airdrop by April?,Economics & Business
Will Biden drop out of presidential race?,Politics & Governance
Will the Epstein documents name Prince Andrew?,Politics & Governance
Will Vivek Ramaswamy win the popular vote in the 2024 Presidential Election?,Politics & Governance
Will Miami Heat be champions of the 2023-24 NBA season?,Sports
Will Orlando Magic be champions of the 2023-24 NBA season?,Sports
"Will ""Biden"" be said by every candidate in the 4th RNC primary debate?",Politics & Governance
Will Messi win Ballon d'Or?,Sports
Adam D'Angelo leaves OpenAI board by Nov 30?,Science & Tech
Will Hamas release any Russian hostages by November 30?,Politics & Governance
Will a Korean team win LOL Worlds 2023?,Sports
Will Washington Wizards be champions of the 2023-24 NBA season?,Sports
Will a hurricane make landfall in the US in November?,Science & Tech
Will Memphis Grizzlies be champions of the 2023-24 NBA season?,Sports
Will Dallas Mavericks be champions of the 2023-24 NBA season?,Sports
Will Houston Rockets be champions of the 2023-24 NBA season?,Sports
"Will ""terrorist"" be said 10 or more times in the 4th RNC primary debate?",Politics & Governance
"Will ""Putin"" be said by every candidate in the 4th RNC primary debate?",Politics & Governance
Will Linda Yaccarino remain CEO of X through 2023?,Economics & Business
Will Trump be disqualified from California's primary ballot?,Politics & Governance
testasjlk,DROP
wefawefawf,DROP
Will SpaceX's Starship lift 500m from pad by Nov 19?,Science & Tech
Will New Orleans Pelicans be champions of the 2023-24 NBA season?,Sports
Epstein documents unsealed by Jan 31?,Politics & Governance
Will San Antonio Spurs be champions of the 2023-24 NBA season?,Sports
Will Denver Nuggets be champions of the 2023-24 NBA season?,Sports
"Will ""Israel"" be said 20 or more times in the 4th RNC primary debate?",Politics & Governance
Will Mitch McConnell remain senator through 2023?,Politics & Governance
Will Kraken IPO by June?,Economics & Business
Will the Fed raise interest rates by 25 bps after its December meeting?,Economics & Business
Will Hikaru win the FIDE Grand Swiss 2023?,Sports
archUS Presidential Election: Will Joe Biden win?,Politics & Governance
Will ‘The Hunger Games: The Ballad of Songbirds & Snakes’ have a bigger opening weekend than 'The Marvels'?,Arts & Recreation
Will Portland Trail Blazers be champions of the 2023-24 NBA season?,Sports
Will Oklahoma City Thunder be champions of the 2023-24 NBA season?,Sports
Will Minnesota Timberwolves be champions of the 2023-24 NBA season?,Sports
Will Cosmos Hub fork by Dec 31?,Science & Tech
Will Andy Levin be the next Secretary of Labor?,Politics & Governance
Will Eric Adams resign by Nov 30?,Politics & Governance
Fuel shipments to Gaza by Nov 30?,Politics & Governance
Will the Fed raise interest rates by 0 bps after its December meeting?,Economics & Business
Will AI be the 2023 TIME Person of the Year?,Arts & Recreation
Will Utah Jazz be champions of the 2023-24 NBA season?,Sports
George Santos expelled in 2023?,Politics & Governance
Will Golden State Warriors be champions of the 2023-24 NBA season?,Sports
Community notes on Biden Xeet by December 11?,Politics & Governance
Will Sergio Massa win by more than 5% in the 2023 Argentina Presidential election?,Politics & Governance
Sam back as CEO of OpenAI?,Economics & Business
AGI before 2025?,Science & Tech
Will LA Clippers be champions of the 2023-24 NBA season?,Sports
Will Los Angeles Lakers be champions of the 2023-24 NBA season?,Sports
Will Qatar buy Bitcoin by Jan 31?,Economics & Business
Will Binance pay >$4b to settle with the US?,Economics & Business
Will 'The Hunger Games: The Ballad of Songbirds & Snakes' gross over $40m opening weekend?,Arts & Recreation
Will Javier Milei win by more than 5% in the 2023 Argentina Presidential election?,Politics & Governance
archWill Putin remain President of Russia through March?,Politics & Governance
Will Trump win the most primaries through March?,Politics & Governance
"$BTC price between $47,500-50,000 1 hour after ETF approval?",Economics & Business
Will Xi Jinping be the 2023 TIME Person of the Year?,Politics & Governance
Will any MIT faculty lose their job due to plagiarism in January?,Education & Research
Will Israel launch a major ground offensive in Gaza by Oct 31?,Politics & Governance
Tiktok banned in the US by June 30?,Politics & Governance
Will any other Republican Politician win the popular vote in the 2024 Presidential Election?,Politics & Governance
Will Vivek Ramaswamy win the New Hampshire Republican Primary?,Politics & Governance
Celestia token above $5 one week after airdrop?,Economics & Business
Will Kanye West win the popular vote in the 2024 Presidential Election?,Politics & Governance
Will Sacramento Kings be champions of the 2023-24 NBA season?,Sports
Will Phoenix Suns be champions of the 2023-24 NBA season?,Sports
Will Jordan Henderson leave Saudi Arabia this transfer window?,Sports
"Will ""Trump"" be said by every candidate in the 4th RNC primary debate?",Politics & Governance
Ethereum ETF approved by May 31?,Economics & Business
Will Sheffield United win an EPL game by Dec 31?,Sports
Will there be a US government shutdown by November 19?,Politics & Governance
Will Trump visit Israel by Nov 15?,Politics & Governance
Will any major Iranian oil refinery be taken out by Nov 30?,Security & Defenses
Emmett Shear still CEO of OpenAI by end of week?,Economics & Business
Will Maersk resume shipping through Red Sea by March 31?,Economics & Business
Was Sam Altman fired for sexually abusing his sister?,DROP
"Golden Globes 2022: Will ""CODA"" win Best Motion Picture - Drama?",Arts & Recreation
Will Hamas release more hostages by November 17?,Politics & Governance
Will a European team win LOL Worlds 2023?,Sports
Will the Fed raise interest rates by 0 bps after its November meeting?,Economics & Business
Meissner effect confirmed near room temperature?,Science & Tech
Will 'Taylor Swift: The Eras Tour' movie gross over $125m opening weekend?,Arts & Recreation
 Israeli troops on the ground in Gaza by the end of this week?,Politics & Governance
Will Israel regain control of all territory by Oct 10?,Politics & Governance
US inflation >0% from Oct to Nov 2023?,Economics & Business
Will Josh Giddey's contract be terminated?,Sports
Will a North American team make it to the knockout stage in LoL Worlds?,Sports
Bangladesh Election: Sheikh Hasina reelected as Prime Minister?,Politics & Governance
Will Musk's ChatGPT competitor launch in 2023?,Science & Tech
Will Blur Season 2 end this year?,Arts & Recreation
Will Aaron Rodgers play again by October 29?,Sports
"Will ""Hamas"" be said 10 or more times in the 4th RNC primary debate?",Politics & Governance
Saudi Arabia non-oil GDP % up in Q3?,Economics & Business
Will 'Napoleon' gross over $32.5m over its 5-day opening weekend?,Arts & Recreation
Will 'Wish' gross over $55m over its 5-day opening weekend?,Arts & Recreation
Celestia token above $1 one week after airdrop?,Economics & Business
Will the Miami Dolphins win Super Bowl LVIII?,Sports
SBF sentenced to life?,Politics & Governance
Will 'Five Nights at Freddy's' gross over $100m opening weekend?,Arts & Recreation
Will Kamala Harris win the 2024 US Presidential Election?,Politics & Governance
Sam Altman announces new company by Nov 24?,Economics & Business
Portal airdrop by March 1?,Science & Tech
Will Man City win the Premier League?,Sports
Will Saudi Arabia accept invitation to join BRICS?,Politics & Governance
Will $BTC dip below $15000 by Nov 11?,Economics & Business
Will Glenn Youngkin win the 2024 Republican presidential nomination?,Politics & Governance
Will a major hurricane make landfall in the lower 48 states by October 31?,Science & Tech
awefaefwef,DROP
arch: Russian Coup: Putin vs Wagner arch,Politics & Governance
Will Hunter Biden make a plea bargain before April?,Politics & Governance
"Will John F. Kennedy Jr. make a speech in Dallas, Texas by December 2?",DROP
SPAMTEST0997asd,DROP
Ethereum spot ETF approved by June 30?,Economics & Business
Bitcoin ETF approved by Jan 15?,Economics & Business
Will the jury find Derek Chauvin guilty? you,Politics & Governance
Will Kygo's Nifty Gateway drop generate over $10M in total sales?,Arts & Recreation
Will the Blast bridge be exploited by end of February?,Security & Defenses
"Golden Globes 2022: Will ""Belfast"" win Best Motion Picture - Drama?",Arts & Recreation
Will Sweden join NATO by February 29?,Politics & Governance
Will Katie Porter advance from the 2024 CA Senate Primary?,Politics & Governance
Over $4 billion inflows in spot Bitcoin ETFs on first day of trading?,Economics & Business
SEC approves first spot Bitcoin ETF on Jan 9?,Economics & Business
Will Bernie Sanders win the 2024 US Presidential Election?,Politics & Governance
Will Mahmoud Abbas still be President of the State of Palestine by the end of 2023?,Politics & Governance
Kamino airdrop by March 1?,Security & Defenses
Will Mark Cuban announce presidential run by EOY?,Politics & Governance
Taiwan Presidential Election: Will Lai Ching-te win?,Politics & Governance
Will Michelle Obama win the 2024 US Presidential Election?,Politics & Governance
Will any other Republican Politician win the 2024 US Presidential Election?,Politics & Governance
Will the SEC approve BlackRock's Bitcoin ETF by December 31?,Economics & Business
Will the KyberSwap hacker return 50% of the exploited funds by Dec 15?,Security & Defenses
Will the Fed decrease interest rates by 25 bps after its January meeting?,Economics & Business
Will GPT-4 have 500b+ parameters?,Science & Tech
Will another 'Forbes 30 Under 30' be arrested in 2023?,Economics & Business
Texans vs. Colts: Margin of Victory 14-20?,Sports
Will Tim Ryan be the next Secretary of Labor?,Politics & Governance
OpenSea token in 2024?,Economics & Business
Will Laphonza Butler advance from the 2024 CA Senate Primary?,Politics & Governance
Will Trump win every state in Republican Nomination?,Politics & Governance
Will Ecuadorian drug lord Fito remain at large throughout January?,Security & Defenses
Will Shein IPO at a $90b valuation?,Economics & Business
Will Trump appear on Colorado primary ballot?,Politics & Governance
Will 'The Marvels' flop?,Arts & Recreation
OpenAI settlement with NYT by March?,Economics & Business
Will another plane's cabin door blow off in January?,Security & Defenses
Will the Atlanta Falcons win Super Bowl LVIII?,Sports
2023-24 Detroit Pistons worst NBA team of all time?,Sports
Sally Kornbluth out as MIT President in January?,Education & Research
Will Vivek Ramaswamy win the U.S. 2024 Republican vice presidential nomination?,Politics & Governance
$Bitcoin (Hpos10i) all time high by Jan 31?,Economics & Business
"Will Joe Biden be President of the United States on April 1, 2024?",Politics & Governance
Will Zuck KO Musk?,Economics & Business
Will US attack Yemen in 2023?,Security & Defenses
2024 presidential election: GOP wins by 105-154,Politics & Governance
"$BTC price >$50,000 1 hour after ETF approval?",Economics & Business
Will the Tampa Bay Buccaneers win Super Bowl LVIII?,Sports
2024 presidential election: Democrats win by 5-14,Politics & Governance
Blast airdrop by May?,DROP
Will Donald Trump be the next major GOP presidential race dropout?,Politics & Governance
Will Kanye West win the U.S. 2024 Republican presidential nomination?,Politics & Governance
Venezuela oil production >1 million barrels/day by Q1 2024?,Economics & Business
Another Ledger leak/exploit by Mar 31?,Security & Defenses
Will Elizabeth Warren win the 2024 US Presidential Election?,Politics & Governance
Trump and Biden both win nomination?,Politics & Governance
"$BTC price between $42,500-45,000 1 hour after ETF approval?",Economics & Business
Will Kamala Harris win the U.S. 2024 Democratic presidential nomination?,Politics & Governance
"$BTC price between $40,000-42,500 1 hour after ETF approval?",Economics & Business
Pudgy Penguins airdrop before March?,Economics & Business
Ceasefire between Russia and Ukraine by June?,Politics & Governance
JUP above $1 one week after launch?,Economics & Business
Will Chris Christie win the popular vote in the 2024 Presidential Election?,Politics & Governance
Will Joe Biden's 538 approval rating be greater than 39.5% on January 7?,Politics & Governance
Will the Kansas City Chiefs win Super Bowl LVIII?,Sports
$SPX6900 all time high by Jan 31?,Economics & Business
2024 presidential election: Democrats win by 155-214,Politics & Governance
Trump and Biden both lose nomination?,Politics & Governance
Will the Fed raise interest rates by 25 bps after its January meeting?,Economics & Business
2024 presidential election: GOP wins by 1-4,Politics & Governance
Will Nikki Haley win the 2024 Republican Iowa Caucus?,Politics & Governance
Will Blur Season 3 end by May?,Arts & Recreation
Will any other Democrat Politician win the popular vote in the 2024 Presidential Election?,Politics & Governance
Will Adam Schiff advance from the 2024 CA Senate Primary?,Politics & Governance
Ethereum spot ETF approved by Mar 31?,Economics & Business
Will Young Thug be found guilty of racketeering conspiracy?,Security & Defenses
Will there be a US government shutdown by Jan 20?,Politics & Governance
2024 presidential election: GOP wins by 155-214,Politics & Governance
Another Celestia airdrop by March 1?,Economics & Business
AI on Amazon speaker by June?,Science & Tech
2024 presidential election: Democrats win by 0-4,Politics & Governance
Will Trump win the 2024 Iowa Caucus?,Politics & Governance
Will Chris Christie win the 2024 US Presidential Election?,Politics & Governance
2024 presidential election: Democrats win by 215+,Politics & Governance
Will 2024 be better than 2023?,DROP
Will Dean Phillips win the U.S. Democratic presidential nomination?,Politics & Governance
North Korea nuke by March 31?,Security & Defenses
None,DROP
None,DROP
None,DROP
None,DROP
None,DROP
None,DROP
None,DROP
None,DROP
None,DROP
None,DROP
None,DROP
None,DROP
None,DROP
None,DROP
None,DROP
None,DROP
None,DROP
None,DROP
None,DROP
None,DROP
None,DROP
None,DROP
None,DROP
None,DROP
None,DROP
None,DROP
None,DROP
None,DROP
None,DROP
None,DROP
None,DROP
None,DROP
None,DROP
None,DROP
None,DROP
None,DROP
None,DROP
None,DROP
None,DROP
None,DROP
None,DROP
None,DROP
None,DROP
None,DROP
None,DROP
None,DROP
None,DROP
None,DROP
None,DROP
None,DROP
None,DROP
None,DROP
None,DROP
None,DROP
None,DROP
None,DROP
None,DROP
None,DROP
None,DROP
None,DROP
None,DROP
None,DROP
None,DROP
None,DROP
None,DROP
None,DROP
None,DROP
None,DROP
None,DROP
None,DROP
None,DROP
None,DROP
None,DROP
None,DROP
None,DROP
None,DROP
None,DROP
None,DROP
None,DROP
None,DROP
None,DROP
None,DROP
None,DROP
None,DROP
None,DROP
None,DROP
None,DROP
None,DROP
None,DROP
None,DROP
None,DROP
None,DROP
None,DROP
None,DROP
None,DROP
None,DROP
None,DROP
None,DROP
None,DROP
None,DROP
None,DROP
None,DROP
None,DROP
None,DROP
None,DROP
None,DROP
None,DROP
None,DROP
None,DROP
None,DROP
None,DROP
None,DROP
None,DROP
None,DROP
None,DROP
None,DROP
None,DROP
None,DROP
None,DROP
None,DROP
None,DROP
None,DROP
None,DROP
None,DROP
None,DROP
None,DROP
None,DROP
None,DROP
None,DROP
None,DROP
None,DROP
None,DROP
None,DROP
None,DROP
None,DROP
None,DROP
None,DROP
None,DROP
None,DROP
None,DROP
None,DROP
None,DROP
None,DROP
None,DROP
None,DROP
None,DROP
None,DROP
None,DROP
None,DROP
None,DROP
None,DROP
None,DROP
None,DROP
None,DROP
None,DROP
None,DROP
None,DROP
None,DROP
None,DROP
None,DROP
None,DROP
None,DROP
None,DROP
None,DROP
None,DROP
None,DROP
None,DROP
None,DROP
None,DROP
None,DROP
None,DROP
None,DROP
None,DROP
None,DROP
None,DROP
None,DROP
None,DROP
None,DROP
None,DROP
None,DROP
None,DROP
None,DROP
None,DROP
None,DROP
None,DROP
None,DROP
None,DROP
None,DROP
None,DROP
None,DROP
None,DROP
None,DROP
None,DROP
None,DROP
None,DROP
None,DROP
None,DROP
None,DROP
None,DROP
None,DROP
None,DROP
None,DROP
None,DROP
None,DROP
None,DROP
None,DROP
None,DROP
None,DROP
None,DROP
None,DROP
None,DROP
None,DROP
None,DROP
None,DROP
None,DROP
None,DROP
None,DROP
None,DROP
None,DROP
None,DROP
None,DROP
None,DROP
None,DROP
None,DROP
None,DROP
None,DROP
None,DROP
None,DROP
None,DROP
None,DROP
None,DROP
None,DROP
None,DROP
None,DROP
None,DROP
None,DROP
None,DROP
None,DROP
None,DROP
None,DROP
None,DROP
None,DROP
None,DROP
None,DROP
None,DROP
None,DROP
None,DROP
None,DROP
None,DROP
None,DROP
None,DROP
None,DROP
None,DROP
None,DROP
None,DROP
None,DROP
None,DROP
None,DROP
None,DROP
None,DROP
None,DROP
None,DROP
None,DROP
None,DROP
None,DROP
None,DROP
None,DROP
None,DROP
None,DROP
None,DROP
None,DROP
None,DROP
None,DROP
None,DROP
None,DROP
None,DROP
None,DROP
None,DROP
None,DROP
None,DROP
None,DROP
None,DROP
None,DROP
None,DROP
None,DROP
None,DROP
None,DROP
None,DROP
None,DROP
None,DROP
None,DROP
None,DROP
None,DROP
None,DROP
None,DROP
None,DROP
None,DROP
None,DROP
None,DROP
None,DROP
None,DROP
None,DROP
None,DROP
None,DROP
None,DROP
None,DROP
None,DROP
None,DROP
None,DROP
None,DROP
None,DROP
None,DROP
None,DROP
None,DROP
None,DROP
None,DROP
None,DROP
None,DROP
None,DROP
None,DROP
None,DROP
None,DROP
None,DROP
None,DROP
None,DROP
None,DROP
None,DROP
None,DROP
None,DROP
None,DROP
None,DROP
None,DROP
None,DROP
None,DROP
None,DROP
None,DROP
None,DROP
None,DROP
None,DROP
None,DROP
None,DROP
None,DROP
None,DROP
None,DROP
None,DROP
None,DROP
None,DROP
None,DROP
None,DROP
None,DROP
None,DROP
None,DROP
None,DROP
None,DROP
None,DROP
None,DROP
None,DROP
None,DROP
None,DROP
None,DROP
None,DROP
None,DROP
None,DROP
None,DROP
None,DROP
None,DROP
None,DROP
None,DROP
None,DROP
None,DROP
None,DROP
None,DROP
None,DROP
None,DROP
None,DROP
None,DROP
None,DROP
None,DROP
None,DROP
None,DROP
None,DROP
None,DROP
None,DROP
None,DROP
None,DROP
None,DROP
None,DROP
None,DROP
None,DROP
None,DROP
None,DROP
None,DROP
None,DROP
None,DROP
None,DROP
None,DROP
None,DROP
None,DROP
None,DROP
None,DROP
None,DROP
None,DROP
None,DROP
None,DROP
None,DROP
None,DROP
None,DROP
None,DROP
None,DROP
None,DROP
None,DROP
None,DROP
None,DROP
None,DROP
None,DROP
None,DROP
None,DROP
None,DROP
None,DROP
None,DROP
None,DROP
None,DROP
None,DROP
None,DROP
None,DROP
None,DROP
None,DROP
None,DROP
None,DROP
None,DROP
None,DROP
None,DROP
None,DROP
None,DROP
None,DROP
None,DROP
None,DROP
None,DROP
None,DROP
None,DROP
None,DROP
None,DROP
None,DROP
None,DROP
None,DROP
None,DROP
None,DROP
None,DROP
None,DROP
None,DROP
None,DROP
None,DROP
None,DROP
None,DROP
None,DROP
None,DROP
None,DROP
None,DROP
None,DROP
None,DROP
None,DROP
None,DROP
None,DROP
None,DROP
None,DROP
None,DROP
None,DROP
None,DROP
None,DROP
None,DROP
None,DROP
None,DROP
None,DROP
None,DROP
None,DROP
None,DROP
None,DROP
None,DROP
None,DROP
None,DROP
None,DROP
None,DROP
None,DROP
None,DROP
None,DROP
None,DROP
None,DROP
None,DROP
None,DROP
None,DROP
None,DROP
None,DROP
None,DROP
None,DROP
None,DROP
None,DROP
None,DROP
None,DROP
None,DROP
None,DROP
None,DROP
None,DROP
None,DROP
None,DROP
None,DROP
None,DROP
None,DROP
None,DROP
None,DROP
None,DROP
None,DROP
None,DROP
None,DROP
None,DROP
None,DROP
None,DROP
None,DROP
None,DROP
None,DROP
None,DROP
None,DROP
None,DROP
None,DROP
None,DROP
None,DROP
None,DROP
None,DROP
None,DROP
None,DROP
None,DROP
None,DROP
None,DROP
None,DROP
None,DROP
None,DROP
None,DROP
None,DROP
None,DROP
None,DROP
None,DROP
None,DROP
None,DROP
None,DROP
None,DROP
None,DROP
None,DROP
None,DROP
None,DROP
None,DROP
None,DROP
None,DROP
None,DROP
None,DROP
None,DROP
None,DROP
None,DROP
None,DROP
None,DROP
None,DROP
None,DROP
None,DROP
None,DROP
None,DROP
None,DROP
None,DROP
None,DROP
None,DROP
None,DROP
None,DROP
None,DROP
None,DROP
None,DROP
None,DROP
None,DROP
None,DROP
None,DROP
None,DROP
None,DROP
None,DROP
None,DROP
None,DROP
None,DROP
None,DROP
None,DROP
None,DROP
None,DROP
None,DROP
None,DROP
None,DROP
None,DROP
None,DROP
None,DROP
None,DROP
None,DROP
None,DROP
None,DROP
None,DROP
None,DROP
None,DROP
None,DROP
None,DROP
None,DROP
None,DROP
None,DROP
None,DROP
None,DROP
None,DROP
None,DROP
None,DROP
None,DROP
None,DROP
None,DROP
None,DROP
None,DROP
None,DROP
None,DROP
None,DROP
None,DROP
None,DROP
None,DROP
None,DROP
None,DROP
None,DROP
None,DROP
None,DROP
None,DROP
