question,category
Will The S&P 500 (INDEXSP: .INX) From 2pm-4pm Move Higher On November 7th? [Ṁana Leaderboard] *TEST MARKET*,Economics & Business
Will the upcoming James Bond game show get a second season?,Arts & Recreation
Will Joe Biden fall again during his first term as President?,Politics & Governance
Will the S&P 500 close higher on November 7 than it closed on November 6?,Economics & Business
Will Manifold allow you to change your account email address before July 2024?,Science & Tech
Will I @Voidvamp be promoted to Diamond or demoted to gold in Season 7 of Platinum League - Predictive Leprechauns?,Sports
Cybertruck appears in 2025 Oscars nominated movie,Arts & Recreation
⚽️ Will France 🇫🇷 beat Gibraltar 🇬🇮 by 3 goals or more at the Euro Qualifiers 🇪🇺?,Sports
Will Bernie Sanders file for reelection to the Senate before 2024?,Politics & Governance
Will Mbappé score against AC Milan on match 4 of the UEFA Champions League 2023-24 Group Stage?,Sports
Will Donald Trump win the 2024 presidential election?,Politics & Governance
"Will TON add 2023.07 opcodes to mainnet by end of May, 2024?",Science & Tech
Will TON network fees change by the end of 2024?,Science & Tech
Will Canada call for an early federal election before the 2025 election?,Politics & Governance
Will Turkey become militarily involved in Gaza before the end of 2024?,Politics & Governance
⚽️ Will France 🇫🇷 beat Greece 🇬🇷 in game 10 of the Euro Qualifiers 🇪🇺?,Sports
Will OpenAI’s new Whisper V3 be able to read the alphabet properly?,Science & Tech
Will the New England Patriots zerstören the Indianapolis Colts? 🏈 Germany,Sports
Will Israel continue to have Gaza city encircled by the end of 2023?,Politics & Governance
"[Metaculus] Will western sources conclude, before 2025, that Israel has used white phosphorus improperly?",Politics & Governance
Will there be an x2 spike in daily active users on EOY 2023?,Economics & Business
NFL🏈-Week 11 Will the Pittsburgh Steelers win their NFL Game against the Cleveland Browns on 11/19?,Sports
Will the Cowboys beat the Eagles at any point during the 2023 season (playoffs included)?,Sports
Resolve % increases 2% for each 0.01C November 2023 temperature anomaly is above 1.00C per Gistemp vs 1951-1980 base,Science & Tech
Will the Giants start someone other than Tommy DeVito at QB in a game between Weeks 10-12?,Sports
"Between now and December 6th, Destiny will do 20+ debates about Israel-Palestine.",Politics & Governance
Will the Israel-Gaza war last more than 2 years?,Politics & Governance
"After the Israel-Hamas war is over, would the average Israeli believe it was a mistake?",Politics & Governance
Will Marvin Harrison Jr. be a top 3 pick in the 2024 NFL Draft?,Sports
Will Waymo's driverless robotaxi service/technology be sold or abandoned by the end of 2024,Economics & Business
Will Mira create a companion Sudoku Solver Market about X.AI's Grok before July 2024?,Science & Tech
Will the Nasdaq Composite (IXIC) close higher on November 7th than it closed on November 6th?  [Ṁana Leaderboard]{DAILY},Economics & Business
Will the Nasdaq Composite (IXIC) close higher on November 8th than it closed on November 7th?  [Ṁana Leaderboard]{DAILY},Economics & Business
Will CAC 40 close higher november 7th than the close of november 6th?,Economics & Business
Will the Nasdaq Composite (IXIC) close higher on November 13 than it closed on November 10?  [Ṁana Leaderboard]{DAILY},Economics & Business
Will Lufthansa close higher november 7th than the close of november 6th?,Economics & Business
Will Deutsche Telekom close higher november 7th than the close of november 6th?,Economics & Business
Will the Dow Jones (DJI) close higher on November 10th than on November 9th? [Ṁana Leaderboard]{DAILY},Economics & Business
Will Waymo give driverless rides on any SF freeways by the end of 2023? [description],Science & Tech
Will Waymo give driverless rides on any SF freeways by the end of Q3 2024? [description],Science & Tech
Will the Dow Jones (DJI) close higher on November 13th than on November 10th? [Ṁana Leaderboard]{DAILY},Economics & Business
Will the Dow Jones (DJI) close higher on November 9th than on November 8th? [Ṁana Leaderboard]{DAILY},Economics & Business
Will the Nasdaq Composite (IXIC) close higher on November 9th than it closed on November 8th?  [Ṁana Leaderboard]{DAILY},Economics & Business
Will the Nasdaq Composite (IXIC) close higher on November 10 than it closed on November 9?  [Ṁana Leaderboard]{DAILY},Economics & Business
Will Waymo give driverless rides on any SF freeways by the end of 2024? [description],Science & Tech
Will Waymo give driverless rides on any SF freeways by the end of Q2 2024? [description],Science & Tech
Will Waymo give driverless rides on any SF freeways by the end of Q1 2024? [description],Science & Tech
Will the VIX (INDEXCBOE: VIX) close higher on November 8th than it closed on November 7th? [Ṁana Leaderboard]{DAILY},Economics & Business
Will The Russell 2000 (RUT) close higher on November 13th than it closed on November 10th?  [Ṁana Leaderboard]{DAILY},Economics & Business
Will the VIX (INDEXCBOE: VIX) close higher on November 9th than it closed on November 8th? [Ṁana Leaderboard]{DAILY},Economics & Business
Will the Dow Jones (DJI) close higher on November 8th than on November 7th? [Ṁana Leaderboard]{DAILY},Economics & Business
Will The Russell 2000 (RUT) close higher on November 7th than it closed on November 6th?  [Ṁana Leaderboard]{DAILY},Economics & Business
Will all three of my kids go to school every day 11/13-11/17 without leaving early or going in late bc they are sick,Education & Research
Will the VIX (INDEXCBOE: VIX) close higher on November 7th than it closed on November 6th? [Ṁana Leaderboard]{DAILY},Economics & Business
Will DAX Performance Index close higher november 7th than the close of november 6th?,Economics & Business
Will Deutsche Bank AG close higher november 7th than the close of november 6th?,Economics & Business
Will the Dow Jones (DJI) close higher on November 7th than on November 6rd? [Ṁana Leaderboard]{DAILY},Economics & Business
Will the VIX (INDEXCBOE: VIX) close higher on November 13th than it closed on November 10th? [Ṁana Leaderboard]{DAILY},Economics & Business
Will the VIX (INDEXCBOE: VIX) close higher on November 10th than it closed on November 9th? [Ṁana Leaderboard]{DAILY},Economics & Business
Will EURO STOXX 50 close higher november 7th than the close of november 6th?,Economics & Business
Is the Nashville shooter manifesto fake?,Politics & Governance
Will The Russell 2000 (RUT) close higher on November 10th than it closed on November 9th?  [Ṁana Leaderboard]{DAILY},Economics & Business
Will The Russell 2000 (RUT) close higher on November 8th than it closed on November 7th?  [Ṁana Leaderboard]{DAILY},Economics & Business
Will The Russell 2000 (RUT) close higher on November 9th than it closed on November 8th?  [Ṁana Leaderboard]{DAILY},Economics & Business
Will Bitcoin Cash (BCH/USD) Close Higher November 12th Than The Close Of November 11th?  [ṀANA PRIZE LEADERBOARD]{DAILY},Economics & Business
Will Bitcoin Cash (BCH/USD) Close Higher November 8th Than The Close Of November 7th?  [ṀANA PRIZE LEADERBOARD]{DAILY},Economics & Business
Will Bitcoin Cash (BCH/USD) Close Higher November 6th Than The Close Of November 5th?  [ṀANA PRIZE LEADERBOARD]{DAILY},Economics & Business
Will Bitcoin Cash (BCH/USD) Close Higher November 10th Than The Close Of November 9th?  [ṀANA PRIZE LEADERBOARD]{DAILY},Economics & Business
Will Bitcoin Cash (BCH/USD) Close Higher November 11th Than The Close Of November 10th?  [ṀANA PRIZE LEADERBOARD]{DAILY},Economics & Business
Will Ethereum (ETH/USD) Close Higher November 10th Than The Close Of November 9th? [ṀANA PRIZE LEADERBOARD]{DAILY},Economics & Business
Will Bitcoin Cash (BCH/USD) Close Higher November 7th Than The Close Of November 6th?  [ṀANA PRIZE LEADERBOARD]{DAILY},Economics & Business
Will Ethereum (ETH/USD) Close Higher November 12th Than The Close Of November 11th? [ṀANA PRIZE LEADERBOARD]{DAILY},Economics & Business
Will Ethereum (ETH/USD) Close Higher November 11th Than The Close Of November 10th? [ṀANA PRIZE LEADERBOARD]{DAILY},Economics & Business
Will Bitcoin Cash (BCH/USD) Close Higher November 9th Than The Close Of November 8th?  [ṀANA PRIZE LEADERBOARD]{DAILY},Economics & Business
Will Ethereum (ETH/USD) Close Higher November 6th Than The Close Of November 5th? [ṀANA PRIZE LEADERBOARD]{DAILY},Economics & Business
Will Ethereum (ETH/USD) Close Higher November 7th Than The Close Of November 6th? [ṀANA PRIZE LEADERBOARD]{DAILY},Economics & Business
HAAS's appeal of the 2023 Formula 1 US Grand Prix result will be successful,Sports
Will Daniel Ricciardo finish on the podium at the Las Vegas GP 2023?,Sports
Will Litecoin (LTC/USD) Close Higher November 8th Than The Close Of November 7th? [ṀANA PRIZE LEADERBOARD]{DAILY),Economics & Business
Will Litecoin (LTC/USD) Close Higher November 10th Than The Close Of November 9th? [ṀANA PRIZE LEADERBOARD]{DAILY),Economics & Business
Will Litecoin (LTC/USD) Close Higher November 6th Than The Close Of November 5th? [ṀANA PRIZE LEADERBOARD]{DAILY),Economics & Business
Will Ethereum (ETH/USD) Close Higher November 8th Than The Close Of November 7th? [ṀANA PRIZE LEADERBOARD]{DAILY},Economics & Business
Will the UK's FTSE 100 close higher on 7th November than it closed on 6th November?,Economics & Business
Will Litecoin (LTC/USD) Close Higher November 12th Than The Close Of November 11th? [ṀANA PRIZE LEADERBOARD]{DAILY),Economics & Business
Will Litecoin (LTC/USD) Close Higher November 9th Than The Close Of November 8th? [ṀANA PRIZE LEADERBOARD]{DAILY),Economics & Business
Will Litecoin (LTC/USD) Close Higher November 7th Than The Close Of November 6th? [ṀANA PRIZE LEADERBOARD]{DAILY),Economics & Business
Will Ethereum (ETH/USD) Close Higher November 9th Than The Close Of November 8th? [ṀANA PRIZE LEADERBOARD]{DAILY},Economics & Business
Will Litecoin (LTC/USD) Close Higher November 11th Than The Close Of November 10th? [ṀANA PRIZE LEADERBOARD]{DAILY),Economics & Business
Will Donald Trump commit perjury while testifying in the NY civil fraud trial?,Politics & Governance
Will Ukraine Beat Russia by the End of 2024,Politics & Governance
Will Ostar Piastri finish in the points at the Las Vegas GP 2023?,Sports
T1 vs JDG: Will Faker dumpster Knight?,Sports
Will Fernando Alonso finish on the podium at the Las Vegas GP 2023?,Sports
Will WBG beat BLG,Sports
T1 vs JDG: Will Ruler dumpster Gumayushi?,Sports
Will Lewis Hamilton finish on the podium at the Las Vegas GP 2023?,Sports
Will both Mercedes finish in the points at the Las Vegas GP 2023?,Sports
Will T1 beat JDG,Sports
Will Charles Leclerc finish on the podium at the Las Vegas GP 2023?,Sports
Will Lando Norris finish on the podium at the Las Vegas GP 2023?,Sports
"Will ""Napoleon"" gross >$19M on its opening (3-day) weekend?",Arts & Recreation
Will behavioral prediction markets be used in a dating app before 2025?,Science & Tech
will manifold.love have guessing games before April?,Arts & Recreation
Will Sergio Perez finish on the podium at the Las Vegas GP 2023?,Sports
Will T1 vs JDG go to 5 games?,Sports
T1 vs JDG: Will T1 pick a new champion?,Sports
Will Max Verstappen win the Las Vegas GP 2023?,Sports
Will Israeli soldiers perform ground invasion in south Gaza before 2024?,Politics & Governance
Will the Boston Bruins beat the Stars tonight?,Sports
Will Yann LeCun have a cameo role saving humanity from the Daleks in Doctor Who (series 15),Arts & Recreation
Will there be a league above Masters in 2024?,Sports
Are there infinitely many Sophie Germain primes?,Science & Tech
Will a court slap Donald Trump with another gag order by the end of  2023?,Politics & Governance
Will Chelsea beat Tottenham Hotspur? ⚽ London Derby,Sports
"Will Gaza become a multi-national protectorate of Arab nations (Saudi Arabia, Jordan, UAE, etc) by the end of 2024?",Politics & Governance
"Will ""Napoleon"" gross >$25M on its opening (3-day) weekend?",Arts & Recreation
What % of votes will Sergio Massa get in the Argentinian elections?,Politics & Governance
Will the SAG-Aftra actor’s strike end in November 2023?,Economics & Business
Set and get my burpee goal this week?,Sports
Will the Russian Ruble reach an exchange rate of at least 105 against the USD before the end of January 2024?,Economics & Business
"Will the Maine referendum question 3 on the November 7, 2023 ballot pass?",Politics & Governance
Will actor’s strike end this year?,Arts & Recreation
What % of votes will Javier Milei get in the Argentinian elections?,Politics & Governance
Will Israel expel all Palestinians from Gaza?,Politics & Governance
Will a reliable useful neural device that transmits information about users thoughts be released before the end of 2028?,Science & Tech
Will Hamas control >50% of Gaza at the end of 2024?,Politics & Governance
Will Taiwan open a Representative Office in Estonia by the end of 2024?,Politics & Governance
Will Justin Trudeau will ever serve time in Jail !?,Politics & Governance
Will a flight from the united states crash before 2024?,Security & Defenses
Will I be promoted to diamond?,Arts & Recreation
Will Manifold Users view OpenAI DevDay as a Success?,Economics & Business
Will Wesley So qualify for the 2024 FIDE Candidates Tournament?,Sports
Will the reduction in particulate pollution cause climate warming to accelerate by 2030?,Science & Tech
Will @GinaStuessy and @MattCWilson date for six months?,Arts & Recreation
Will @stephthegeek and @MattCWilson date for six months?,Arts & Recreation
Widespread adoption of cryptocurrency (as currency) by 2035?,Economics & Business
Will the US attack Iran by Dec 15th 2024?,Politics & Governance
[TNF] Total score > 37.5 points for NFL Game Tennessee Titans v/s Pittsburgh Steelers - [11/2],Sports
"[Metaculus] Will copyright of at least one of the depictions of Mickey Mouse be extended bey...dline of January 1, 2024?",Economics & Business
Will the war in Ukraine end before the war in Israel?,Politics & Governance
[Metaculus] Will Twitter announce a policy of marking tweets as possibly AI generated before 2025?,Economics & Business
Will the TSX close higher on November 3 than it did on November 2?,Economics & Business
Will the S&P 500 close higher on November 3 than it closed on November 2?,Economics & Business
Will @hlh and @rainydae date for six months?,Arts & Recreation
Will Haaland win at least 1 Ballon d`Or before retirement?,Sports
[Metaculus] Will Twitter flag any tweet by the New York Times as misinformation before 2025?,Politics & Governance
Will the US attack Iran by May 15th 2024?,Politics & Governance
Will the S&P 500 increase in November 2023?,Economics & Business
Will Tia-Clair Toomey win the 2024 CrossFit Games?,Sports
"[Metaculus] Will any US court rule that Donald J. Trump is disqualified from holding the pre... before January 20, 2025?",Politics & Governance
"Will any NFL team run the ""Bird Gauntlet"" before 2030?",Sports
Will Cruise relaunch driverless taxis in San Francisco by Sept 30 2024?,Economics & Business
Will the US attack Iran by Aug 15th 2024?,Politics & Governance
Will Abdel Fattah el-Sisi win the Egypt Presidential Election?,Politics & Governance
Will @MatchMaker and @ColinMcGlynn date for six months?,Arts & Recreation
Will the US attack Iran by Nov 30th 2023?,Politics & Governance
Will the UK's FTSE 100 close higher on 3rd November than it closed on 2nd November?,Economics & Business
Will Cruise relaunch driverless taxis in San Francisco by Mar 31 2024?,Economics & Business
Will Cruise relaunch driverless taxis in San Francisco by June 30 2024?,Economics & Business
Will Cruise relaunch driverless taxis in San Francisco by Dec 31 2024?,Economics & Business
Will the US attack Iran by Jan 15th 2024?,Politics & Governance
Will the US attack Iran by Mar 15th 2024?,Politics & Governance
Will I demote to Platinum? (Season 7: November),Sports
Will @alexwithease and @AntoniaB date for six months?,Arts & Recreation
Will @stephthegeek and @NathanpmYoung date for six months?,Arts & Recreation
Will I reach a 366 day streak?,Arts & Recreation
Will Bitboy remarry by end of year,Arts & Recreation
Will the Hard Fork YouTube channel reach 10k subscribers by the end of Nov 2023?,Arts & Recreation
Will Venezuela oil production be >1 million barrels/day by March 31st 2024?,Economics & Business
Will median rent in Denver be higher at the end of 2024 than the end of 2023?,Economics & Business
Will Cruise relaunch driverless taxis in San Francisco by Dec 31 2023?,Economics & Business
Will Syria federalize before 2030?,Politics & Governance
Will I be demoted to platinum league?,Sports
Btc,Economics & Business
Will I remain in diamond league?,Sports
"If I get demoted, will it be because of a spike in AI risk?",Economics & Business
Will @foreverinprogress and @jojomonsta date for six months?,Arts & Recreation
Will I be promoted to masters league?,Sports
Will the Dalamtian pelican be a “ reintroduced” or “ resident” breeder in the UK by 2070?,Healthcare & Biology
Will Netanyahu win the next elections in Israel?,Politics & Governance
"Will the ""Will AI wipe out humanity before the year 2100"" market reach 10% by the end of 2024?",Science & Tech
"Will Tetsuya Yamagami, Shinzo Abe's assassin, be free before the end of 2026?",Politics & Governance
Will Netanyahu be imprisoned?,Politics & Governance
Will the Likud win the next Israeli election,Politics & Governance
Will the red backed shrike be a “ reintroduced” or “ resident” breeder in the UK by 2050?,Healthcare & Biology
Will Juan Soto still be a San Diego Padre on Opening Day 2024?,Sports
Will anyone commit violence in order to slow the progression of AI?,Security & Defenses
Will @girlboss and @jojomonsta date for six months?,Arts & Recreation
Will the New York Giants crush the Las Vegas Raiders? 🏈 Sunday Football,Sports
Will Xi Jinping choose a successor in 2027?,Politics & Governance
Will @Rachelclif and @RobiRahman date for six months?,Arts & Recreation
Will @JoyNicoleNohemi and @RobiRahman date for six months?,Arts & Recreation
Will @Swimmer963 and @RobiRahman date for six months?,Arts & Recreation
Will Palestine/Hamas and Israel carry out a  prisoner exchange in 2023?,Politics & Governance
Will Xi Jinping choose a successor in 2032?,Politics & Governance
Will the IDF blow up any more refugee camps before the end of 2023? [Ṁ300 Pool],Security & Defenses
Will @Janethebane and @RobiRahman date for six months?,Arts & Recreation
NFL week 9 Will Panthers QB Bryce Young complete more than 239 passing yards vs Colts?,Sports
Will Leagues profit count only realized profits in Season 8?,Economics & Business
"Will my TON grant proposal ""MulDEX"" be accepted?",Education & Research
Will i get demoted or promoted this Season?,Economics & Business
NFL week 9 Will Texans QB CJ Stroud complete more than 239 passing yards vs Buccaneers?,Sports
NFL week 9 Will Buccaneers QB Baker Mayfield complete more than 240 passing yards vs Texans?,Sports
NFL week 9 Will Ravens QB Lamar Jackson complete more than 230 passing yards vs Seahawks?,Sports
Will there be more than 40 points scored in the Steelers - Titans game tonight.,Sports
A famous American has more children than Elon Musk by mid 2030,Arts & Recreation
Will The US Inflation Rate (on Truflation) be higher than 2.4% on 2023-11-09?,Economics & Business
Will i get demoted to Platinum this Season?,Sports
Will the population of Sub-Saharan Africa exceed 3.5 billion this century?,Economics & Business
Will i get promoted to Masters this Season?,Sports
Will @NinaLee and @CalebW date for six months?,Arts & Recreation
Will someone successfully introduce penguins to the north pole by mid 2031,Science & Tech
Musk child holds elected political office by mid 2034,Politics & Governance
Elon Musk gains grandchild in 2033,Arts & Recreation
Bullet scarred Cybertrucks become a trend by mid 2026,Economics & Business
Elon Musk gains grandchild in 2030,Arts & Recreation
Will the Saudis either buy the XFL/USFL or start their own league to compete with the NFL before 1/1/2025?,Sports
"Elon Musk changes his title to something involving ""Grandpa"" by mid 2029",Economics & Business
Will someone successfully introduce polar bears to the south pole by mid 2031,Science & Tech
"Will Sam Bankman-Fried plead not guilty to a felony charge while serving a jail sentence, by mid 2025",Politics & Governance
Elon Musk gains grandchild in 2032,Arts & Recreation
Elon Musk gains grandchild in 2031,Arts & Recreation
Elon Musk gains grandchild in 2027,Arts & Recreation
Will the population of Northern Africa and Western Asia (combined) exceed 780 million this century?,Economics & Business
A descendant of Elon Musk reaches Mars by end of 2040,Science & Tech
Elon Musk gains grandchild in 2028,Arts & Recreation
A family member of Elon Musk reaches Mars by end of 2040,Science & Tech
Elon Musk gains grandchild in 2026,Arts & Recreation
Will this market have 500 traders by 12/31/2023 (Eastern time)?,Economics & Business
Elon Musk gains grandchild in 2023,Arts & Recreation
Elon Musk gains grandchild in 2025,Arts & Recreation
Elon Musk gains grandchild in 2024,Arts & Recreation
Will we discover proof of extraterrestrial life by the end of 2024?,Science & Tech
Elon Musk gains grandchild in 2029,Arts & Recreation
Will the population of Central and Southern Asia exceed 2.75 billion this century?,Economics & Business
GPT enabled webpage diff tool by EOY,Science & Tech
"Will Manifold.love hit 1,000 signed in viewers in November?",Arts & Recreation
Will the population of Latin America and the Caribbean (combined) exceed 760 million this century?,Economics & Business
"Will the population of Oceania, including Australia and New Zealand, exceed 72 million this century?",Economics & Business
Will the Braves win the 2024 World Series?,Sports
Will a 'civilian' Vice Chairman of Central Military Committee of the CCP be elected before Autumn 2032?,Politics & Governance
Will a 'civilian' Vice Chairman of Central Military Committee of the CCP be elected before Autumn 2027?,Politics & Governance
Will the population of Eastern and South-Eastern Asia exceed 2.45 billion this century?,Science & Tech
Will this market be above 71% at closing?,Economics & Business
"Will MDMA become an approved prescription drug in the United States by June 1, 2024?",Healthcare & Biology
Will the population of Europe and Northern America (combined) exceed 1.15 billion this century?,Economics & Business
"QERC (quantum energy research centre, LK99) press conference by 3/1/2024",Science & Tech
Will the Braves win the 2024 World Series?,Sports
Will both Trump and Vivek Ramaswamy still have their campaigns running on Dec 1 2023,Politics & Governance
"Will Destiny be banned for his ""pro genocide"" comments?",Politics & Governance
Will any of the top 3 LK99 supporters bail on LK-99 through November 2023,Science & Tech
"Will Vasco DA Gama beat Botafogo during regular time on Mon, Nov 6, 2023? - Campeonato Brasileiro Série A",Sports
Will the S&P 500 increase in November 2023?,Economics & Business
Will the S&P 500 increase by over 10% in one day in January 2024,Economics & Business
Will any domesticated animal species go extinct before 2080?,Healthcare & Biology
Will the S&P 500 increase by over 10% in one day in January 2024?,Economics & Business
Will climate change decimate humans before 2070?,Science & Tech
Will both Trump and Vivek Ramaswamy still have their campaigns running on Jan 15 2024,Politics & Governance
Will both Trump and Vivek Ramaswamy still have their campaigns running on March 1 2024,Politics & Governance
Will another member of the Central Military Commission of the PRC be removed from their position before Spring 2028?,Politics & Governance
"Will Tottenham beat Chelsea during regular time on Mon, Nov 6, 2023? - Premier League",Sports
"Will Coritiba beat Goias during regular time on Sun, Nov 5, 2023? - Campeonato Brasileiro Série A",Sports
"Will Fortaleza EC beat Flamengo during regular time on Sun, Nov 5, 2023? - Campeonato Brasileiro Série A",Sports
Will climate change decimate humans before 2090?,Science & Tech
"In 20 years, will the employment:population ratio for prime-age Americans be below 70%?",Economics & Business
Will any member of the Politburo Standing Committee of the CCP be removed from their position before Autumn 2027?,Politics & Governance
Will China launch a military invasion of Taiwan by end of 2024?,Politics & Governance
Will any member of the Politburo of the Chinese Communist Party be removed from their position before Autumn 2027?,Politics & Governance
Will the S&P 500 increase by over 3% in one day in July 2024?,Economics & Business
Will the S&P 500 increase by over 3% in one day in Jan 2024?,Economics & Business
"Will RB Bragantino beat Corinthians during regular time on Sun, Nov 5, 2023? - Campeonato Brasileiro Série A",Sports
"Will Luton beat Liverpool during regular time on Sun, Nov 5, 2023? - Premier League",Sports
"Will Getafe beat Cadiz during regular time on Mon, Nov 6, 2023? - La Liga",Sports
"Will Alaves beat Almeria during regular time on Sun, Nov 5, 2023? - La Liga",Sports
"Will Valencia beat Granada CF during regular time on Sun, Nov 5, 2023? - La Liga",Sports
"Will Nottingham Forest beat Aston Villa during regular time on Sun, Nov 5, 2023? - Premier League",Sports
"Will Villarreal beat Athletic Club during regular time on Sun, Nov 5, 2023? - La Liga",Sports
