question,category
How many units will Ford produce in North America in 2021?,Economics & Business
What will be the closing value of the S&P 500 Index on 29 December 2023?,Economics & Business
"How many people will have been fully vaccinated against COVID-19 in the US as of 30 June 2021, according to the CDC?",Healthcare & Biology
Which team will win the 2023 MLB World Series?,Sports
What will be the US annual real GDP growth rate for the fourth quarter of 2023?,Economics & Business
What percentage of the vote will the Democratic candidate win in the 2023 Kentucky gubernatorial election?,Politics & Governance
Who will win the election for California's 27th Congressional District in 2022?,Politics & Governance
What will be the closing yield for the US 10-Year Treasury on 1 August 2022?,Economics & Business
How many hectares (ha) will be consumed by wildfires in Canada in 2023?,Science & Tech
Who will be elected governor of Georgia in 2022?,Politics & Governance
"Before 1 May 2021, will it be officially announced that the Tokyo 2020 Summer Olympics and/or Paralympics will be canceled?",Sports
What will be Coinbase's end-of-day market capitalization on its first day of public trading?,Economics & Business
How many international visitor arrivals to the US will there be in 2023?,Economics & Business
"Before 1 July 2022, will the CPTPP Commission decide to commence the accession process for the People's Republic of China (PRC) and/or Taiwan?",Economics & Business
"Before 1 January 2024, how many of the ""Big Three"" US automakers will have a work stoppage (either a strike or a lockout) involving the United Auto Workers (UAW) union?",Economics & Business
Who will win the 2021 presidential election in Chile?,Politics & Governance
What will the UK Office of National Statistics report the UK unemployment rate to be for the period March-May 2020?,Economics & Business
How many seats will the Ensemble Citoyens (Citizens Together) alliance win in the next French National Assembly elections?,Politics & Governance
Which will happen next regarding the price of a bitcoin?,Economics & Business
What will be the value of Total Assets of the Federal Reserve as of 27 December 2023?,Economics & Business
Which team will win the 2024 College Football Playoff National Championship?,Sports
"At close of business on 5 November 2020, will the upper limit of the Federal Reserve's target range for the federal funds rate be lower, the same, or higher than it was at close of business on 16 September 2020?",Economics & Business
"On 1 March 2021, how many states will have a COVID-19 positivity rate greater than 10.0%?",Healthcare & Biology
What will be the value of the shipping-costs benchmark Baltic Exchange Dry Index as of 24 December 2021?,Economics & Business
Which film will win the 2020 Oscar® for Directing?,Arts & Recreation
What will be the closing value of the NYSE FANG+ Index on 3 November 2023?,Economics & Business
What will be China's annual GDP growth rate for the first quarter of 2024?,Economics & Business
"Before 15 November 2020, who will be elected to be the next leader of Japan's Liberal Democratic Party (LDP)?",Politics & Governance
When will the Federal Reserve announce it will conclude its monthly quantitative easing bond buying?,Economics & Business
To which political party will the next prime minister of Slovakia belong after the 2023 parliamentary elections?,Politics & Governance
How many total cases of COVID-19 in the U.S. will The COVID Tracking Project report as of Sunday 3 May 2020?,Healthcare & Biology
Which team will win the 2022 MLB World Series?,Sports
Which team will win the 2023 NBA Finals?,Sports
Which driver will finish in second (2nd) place for the 2023 Formula One World Drivers' Championship?,Sports
What will be the weekly average interest rate for 30-year fixed rate mortgages in the US for the week ending 21 March 2024?,Economics & Business
What will be the spot price per barrel for West Texas Intermediate (WTI) crude oil on 29 December 2023?,Economics & Business
Which film will win the 2020 BAFTA Award for Best Film?,Arts & Recreation
How many total Southwest Land Border Encounters will be reported in the US from October 2023 through December 2023 by US Customs and Border Protection (CBP)?,Politics & Governance
Who will next be elected Speaker of the US House of Representatives?,Politics & Governance
"Between 10 July and 31 December 2020, will a firm or paid backup driver operating a self-driving vehicle face criminal charges in relation to an accident involving a self-driving vehicle in the U.S.?",Science & Tech
Which NFL team will win Super Bowl LVII?,Sports
Who will be elected governor of North Carolina in 2020?,Politics & Governance
What will be the closing price for Brent crude oil on 31 March 2020?,Economics & Business
What will be the closing value of the S&P Regional Banks Select Industry Index on 16 June 2023?,Economics & Business
"At close of business on 20 March 2024, will the upper limit of the Federal Reserve's target range for the federal funds rate be lower, the same, or higher than it was at close of business on 31 January 2024?",Economics & Business
How many of the largest commercial banks in the US will fail between 29 September 2023 and 30 September 2024?,Economics & Business
What will be the spot exchange rate value of the US dollar to one euro on 28 March 2024?,Economics & Business
"At close of business on 2 November 2022, will the upper limit of the Federal Reserve's target range for the federal funds rate be lower, the same, or higher than it was at close of business on 21 September 2022?",Economics & Business
Who will win the Republican primary for Wyoming's US House seat in 2022?,Politics & Governance
Who will win the 2023 Nigerian presidential election?,Politics & Governance
How many public Level 2 and DC Fast electric vehicle charging stations will be available in the US as of 29 April 2022?,Science & Tech
Who will win the election for Colorado's 8th Congressional District in 2022?,Politics & Governance
"What will be the oil and gas rig count for the Permian Basin in the first week of October 2022, according to Baker Hughes?",Economics & Business
"What will President Biden’s approval rating be as of 1 May 2023, according to FiveThirtyEight?",Politics & Governance
What will be the average Air Quality Index in Dubai in March 2022?,Science & Tech
Which country will win the 2023 UEFA Nations League Final?,Sports
When will US total nonfarm payrolls next decrease in a given month as compared to the preceding month?,Economics & Business
When will Mahmoud Abbas cease to be president of the Palestinian Authority?,Politics & Governance
Who will win the 2020 Michigan Democratic primary?,Politics & Governance
"At close of business on 27 January 2021, will the upper limit of the Federal Reserve's target range for the federal funds rate be lower, the same, or higher than it was at close of business on 16 December 2020?",Economics & Business
What will be the value of the S&P/Case-Shiller US National Home Price Index for October 2021?,Economics & Business
"On 29 November 2020, how many Learners will be ""already enrolled"" for the Coursera online course “Finding Purpose and Meaning In Life: Living for What Matters Most?""",Education & Research
Who will win the 2022 presidential election in Brazil?,Politics & Governance
"How many new Battery Electric Vehicles (BEVs) will be registered in the UK in April 2023, according to the Society of Motor Manufacturers and Traders (SMMT)?",Economics & Business
When will a SARS-CoV-2 variant other than Delta next represent more than 70.0% of total COVID-19 cases in the US?,Healthcare & Biology
How many NATO member states will spend 2.0% or more of their GDP on defense in 2023?,Security & Defenses
When will Mexico’s Chamber of Deputies approve the Federal Law for the Regulation of Cannabis?,Politics & Governance
What will be the charge-off rate on US credit card loans for all commercial banks in the second quarter of 2024?,Economics & Business
"Between 22 July 2022 and 31 December 2022, how many members will announce their withdrawal from the Cooperation between China and Central and Eastern European Countries (China-CEEC) initiative?",Politics & Governance
"Before 24 July 2020, will it be officially announced that the Tokyo 2020 Summer Olympics and/or Paralympics will be postponed, canceled, and/or relocated?",Sports
How many total cases of COVID-19 in the U.S. will The COVID Tracking Project report as of Sunday 12 April 2020?,Healthcare & Biology
What will be the delinquency rate on commercial real estate loans (excluding farmland) in the United States in the second quarter of 2021?,Economics & Business
How many total cases of COVID-19 will the Public Health Agency of Canada (PHAC) report for Canada as of 31 December 2020?,Healthcare & Biology
What will the Italy-Germany 10-year bond spread be on 16 December 2022?,Economics & Business
"At close of business on 1 November 2023, will the upper limit of the Federal Reserve's target range for the federal funds rate be lower, the same, or higher than it was at close of business on 20 September 2023?",Economics & Business
"In the 2024 US presidential election race, will the Democratic nominee be leading the Republican nominee in polling on 6 September 2024, according to RealClearPolitics?",Politics & Governance
What will happen next to the United Arab Emirate's rolling 7-day average of confirmed cases of COVID-19?,Healthcare & Biology
What will US holiday season retail sales be for 2021 relative to the 2020 holiday season?,Economics & Business
What will be the value of Total Assets of the Federal Reserve as of Wednesday 30 December 2020?,Economics & Business
Will the presidents of Russia and Ukraine meet in person before 1 August 2021?,Politics & Governance
"At close of business on 15 June 2022, will the upper limit of the Federal Reserve's target range for the federal funds rate be lower, the same, or higher than it was at close of business on 4 May 2022?",Economics & Business
"At close of business on 31 December 2020, will Apple be the most valuable publicly traded company in the world?",Economics & Business
What will be the US domestic auto inventory as of May 2022?,Economics & Business
What will be China's annual GDP growth rate for the third quarter of 2023?,Economics & Business
Which candidate will win the 2023 Argentine presidential election?,Politics & Governance
Who will be the Republican nominee for U.S. Senate in Alabama for the 2020 race?,Politics & Governance
For how long will Sam Bankman-Fried be sentenced to serve in prison for his November 2023 federal criminal convictions?,Politics & Governance
"What will be the aggregate reported losses by older adults in the US due to Romance Scams in 2022, according to the Federal Trade Commission (FTC)?",Economics & Business
What will be the closing spot price for Brent crude oil on 19 May 2023?,Economics & Business
Who will win the Democratic Party primary for the New York City mayoral election?,Politics & Governance
"What will be the ""net sympathy"" among Americans for Israelis versus Palestinians in 2024, according to Gallup's World Affairs survey?",Politics & Governance
"Before 4 November 2023, which candidate, excluding Ron DeSantis and Donald Trump, will next have 10.0% or more of 2024 Republican presidential nomination support, according to RealClearPolitics?",Politics & Governance
What will be the FAO Food Price Index for January 2023?,Economics & Business
Which of the following songs will rank highest on the Billboard Hot 100 for the week of 21 May 2022?,Arts & Recreation
"What will be the US domestic box office gross for ""Guardians of the Galaxy Vol. 3"" between and including 5 May 2023 and 29 May 2023, according to Box Office Mojo?",Arts & Recreation
"Between 1 October 2023 and 31 December 2023, how many total fatalities will occur in Somalia due to conflicts and protests, according to ACLED?",Politics & Governance
Who will win the election for Pennsylvania's 17th Congressional District in 2022?,Politics & Governance
"At close of business on 13 December 2023, will the upper limit of the Federal Reserve's target range for the federal funds rate be lower, the same, or higher than it was at close of business on 1 November 2023?",Economics & Business
"What will be the value of the US ""M2"" money supply as of 24 June 2024?",Economics & Business
"What will be the 12-month moving average of median wage growth for ""Paid hourly"" workers in April 2023?",Economics & Business
"When will COVID-19 cases caused by the Delta variant (B.1.617.2) exceed 350,000 in the UK?",Healthcare & Biology
Which presidential candidate will win Wisconsin?,Politics & Governance
Who will win the special election for New York's 3rd Congressional District in 2024?,Politics & Governance
What will happen in the first round of the next presidential election in Poland?,Politics & Governance
Will Mexico hold a referendum on President Andrés Manuel López Obrador before 1 September 2021?,Politics & Governance
How many seats will the European People's Party Group (EPP) win in the 2024 European Parliament (EP) elections?,Politics & Governance
Who will win the 2020 Oscar® for Best Actress?,Arts & Recreation
How many US adult and pediatric hospital admissions with confirmed COVID-19 cases will there be for the week ending 5 June 2021?,Healthcare & Biology
How many games will the Baltimore Orioles have won in the 2022 MLB season as of 1 August 2022?,Sports
When will Russia and Ukraine sign or announce an agreement to end the current conflict in Ukraine?,Politics & Governance
When will new federal legislation enabling the executive branch to ban or prohibit TikTok from operating in the US become law?,Politics & Governance
"How much coal will the US export in the fourth quarter of 2022, according to the US Energy Information Administration (EIA)?",Economics & Business
What will US holiday season retail sales be for 2022 relative to the 2021 holiday season?,Economics & Business
"What percentage of 2024 Democratic presidential nomination support will Joe Biden have as of 31 August 2023, according to RealClearPolitics?",Politics & Governance
What will be the 12-month percentage change in the US Consumer Price Index (CPI) for February 2024?,Economics & Business
"Between 24 February 2023 and 25 August 2023, will former President Donald Trump be criminally charged with or indicted for a federal and/or state crime in the US?",Politics & Governance
How many more total Supercharger stations will Tesla report globally for the fourth quarter of 2023 as compared to the fourth quarter of 2022?,Economics & Business
"Where will Dubai International Airport (DXB) rank among the busiest airports in the world by passenger number for 2020, according to the Airports Council International (ACI)?",Economics & Business
"What will the 12-month percentage change in the US Consumer Price Index (CPI) for ""Food"" in November 2022?",Economics & Business
When will Lebanon's parliament give a vote of confidence to a new government?,Politics & Governance
What will be the weekly average interest rate for 30-year fixed rate mortgages in the US for the week ending 28 December 2023?,Economics & Business
"What will be the United Arab Emirates' ranking in the Global Food Security Index for 2022, according to the Economist Intelligence Unit?",Economics & Business
What will be the closing yield for the UK 10-year gilt (bond) on 31 March 2023?,Economics & Business
When will Russia and Ukraine sign or announce an agreement to end the current conflict in Ukraine?,Politics & Governance
"How many homicides will there be in Chicago, IL, in 2020?",Politics & Governance
What will be the closing price of Mercado Libre stock on 15 February 2021?,Economics & Business
"When will AMC Entertainment Holdings Inc. (AMC), the parent company of AMC Theatres, file for bankruptcy?",Economics & Business
What will be the value of the US Consumer Price Index (CPI) for utility natural gas service in November 2023?,Economics & Business
To which political party will the prime minister elected after the next Pakistani general election belong?,Politics & Governance
When will a new parliamentary election be called in Canada?,Politics & Governance
When will the US lift the suspension of entry for noncitizens who have been present in South Africa during the 14-day period preceding their entry or attempted entry into the US?,Politics & Governance
How far will France advance in the FIFA World Cup 2022?,Sports
"When will the leaders of China, Japan, and South Korea next hold a trilateral meeting in person?",Politics & Governance
"At close of business on 4 May 2022, will the upper limit of the Federal Reserve's target range for the federal funds rate be lower, the same, or higher than it was at close of business on 16 March 2022?",Economics & Business
What will be the closing price per share of the ARK Innovation ETF on 2 September 2022?,Economics & Business
"When will total cases of COVID-19 in Canada reach 2 million or more, according to the Public Health Agency of Canada (PHAC)?",Healthcare & Biology
"Between 4 February 2022 and 4 June 2022, what will be the highest seven-day average for daily new COVID-19 cases in New Zealand?",Healthcare & Biology
What will be the closing value for the US dollar to Chinese renminbi (aka yuan) exchange rate on 29 September 2023?,Economics & Business
How many quarters of negative real GDP growth will the European Union (EU) experience in 2022?,Economics & Business
"Before 1 September 2021, who will be the first to fly successfully to space, Jeff Bezos or Richard Branson?",Science & Tech
"When will Yevgeny Prigozhin either cease to be the leader of the Wagner Group or flee Russia, Ukraine, and Belarus?",Politics & Governance
When will the closing price for Brent crude oil next reach or exceed $130.00 per barrel?,Economics & Business
How many total Fast Charge (>22kW) public charging points for electric vehicles will be installed in the European Union in 2020?,Science & Tech
How many total cases of COVID-19 in the U.S. will The COVID Tracking Project report as of Sunday 26 April 2020?,Healthcare & Biology
What will be the US civilian unemployment rate (U3) for December 2023?,Economics & Business
How many total Southwest Land Border Encounters will be reported in the US from April 2022 through June 2022 by US Customs and Border Protection (CBP)?,Politics & Governance
Will the federal emergency increase in unemployment compensation benefits be extended before 1 August 2020?,Economics & Business
Who will win the election for New York's 22nd Congressional District in 2022?,Politics & Governance
When will the US Congress agree to a new budget resolution?,Politics & Governance
How many presidential candidate debates between the Democratic and Republican nominees will take place before the 2020 general election?,Politics & Governance
When will total cases of Wuhan coronavirus (COVID-19) in California reach 25 or more?,Healthcare & Biology
"How many software as a service (SaaS) companies will be founded in the US in 2023, according to Crunchbase?",Science & Tech
Which football (soccer) club will win the 2023-24 UEFA Champions League final?,Sports
What will be the lowest reported Arctic sea ice extent in 2023 as of 6 October 2023?,Science & Tech
"How much of the U.S. corn crop will be planted as of 31 May 2020, according to the USDA?",Economics & Business
Who will win the election for Virginia's 7th Congressional District in 2022?,Politics & Governance
What will be the yield for US 10-year Treasury securities on 22 March 2024?,Economics & Business
How many total passengers will Australian airline Qantas carry in the second half of 2020?,Economics & Business
What percentage of all light vehicle sales in the US will be either plug-in hybrid vehicles (PHEVs) or all-electric vehicles (EVs) in 2022?,Economics & Business
"Between 3 February 2023 and 30 June 2023, how will the Russell 1000 Growth Index (Growth Index) perform as compared to the Russell 1000 Value Index (Value Index)?",Economics & Business
How many National Assembly seats will the African National Congress (ANC) win in the 2024 South African general election?,Politics & Governance
Will Presidents Claudine Gay of Harvard University and/or Sally Kornbluth of the Massachusetts Institute of Technology (MIT) cease to be the presidents of their respective institutions before 11 January 2024?,Politics & Governance
Who will win the 2020 Oscar® for Best Actor?,Arts & Recreation
What will be Robinhood Markets' end-of-day market capitalization on its first day of public trading?,Economics & Business
What will be the ending stocks of crude oil in the US Strategic Petroleum Reserve (SPR) as of 29 November 2024?,Economics & Business
How many seats in the Legislative Assembly will New Ideas (Nuevas Ideas) win in the 2021 Salvadoran legislative election?,Politics & Governance
"What will be the market capitalization for the global cryptocurrency market on 11 August 2022, according to CoinMarketCap?",Economics & Business
Which team will win the 2023 College Football Playoff national championship?,Sports
How many subscribers will Netflix report for the first quarter of 2023?,Economics & Business
"At close of business on 31 January 2024, will the upper limit of the Federal Reserve's target range for the federal funds rate be lower, the same, or higher than it was at close of business on 13 December 2023?",Economics & Business
"At close of business on 1 May 2024, will the upper limit of the Federal Reserve's target range for the federal funds rate be lower, the same, or higher than it was at close of business on 20 March 2024?",Economics & Business
How many MLB players will have a regular season batting average of .400 or higher in 2020?,Sports
How many acres will be consumed by reported wildfires in the US in 2024?,Science & Tech
"At close of business on 26 January 2022, will the upper limit of the Federal Reserve's target range for the federal funds rate be lower, the same, or higher than it was at close of business on 15 December 2021?",Economics & Business
"When will North Korea next launch an ICBM with an estimated range of at least 10,000 km?",Politics & Governance
Which country will win the 2023 Women's FIFA World Cup?,Sports
What will be China's annual GDP growth rate for the second quarter of 2024?,Economics & Business
What will be Airbnb's end-of-day market capitalization on its first day of public trading?,Economics & Business
When will Florida Governor Ron DeSantis register with the FEC to run for US president in 2024?,Politics & Governance
Who will win the 2020 North Carolina Democratic primary?,Politics & Governance
What will be China's annual GDP growth rate for the first quarter of 2023?,Economics & Business
What will be the closing yield for the Chinese 10-year bond on 10 November 2023?,Economics & Business
Who will win the 2020 Bolivian presidential election?,Politics & Governance
"At close of business on 3 November 2021, will the upper limit of the Federal Reserve's target range for the federal funds rate be lower, the same, or higher than it was at close of business on 22 September 2021?",Economics & Business
How many total vehicles will Tesla produce in the third quarter of 2023?,Economics & Business
When will Jair Bolsonaro return to Brazil?,Politics & Governance
"At close of business on 28 July 2021, will the upper limit of the Federal Reserve's target range for the federal funds rate be lower, the same, or higher than it was at close of business on 16 June 2021?",Economics & Business
"Before 28 July 2020, will Saudi Arabia announce the cancellation or suspension of the Hajj pilgrimage, scheduled for 28 July 2020 to 2 August 2020?",Politics & Governance
"At close of business on 17 March 2021, will the upper limit of the Federal Reserve's target range for the federal funds rate be lower, the same, or higher than it was at close of business on 27 January 2021?",Economics & Business
What will be China's annual GDP growth rate for the fourth quarter of 2023?,Economics & Business
What will be the percentage change in the value of the MSCI Emerging Markets Index in 2023 as compared to 2022?,Economics & Business
"What will be the market capitalization for the global cryptocurrency market on 30 September 2023, according to CoinMarketCap?",Economics & Business
"What will be the US office vacancy rate for the fourth quarter of 2022, according to Colliers?",Economics & Business
When will Canada next permit discretionary travel for foreign nationals arriving from the United States?,Politics & Governance
When will Egypt's official exchange rate for the Egyptian pound to the US dollar next reach or exceed 34.5000?,Economics & Business
"Who will be elected mayor of Los Angeles, California, in 2022?",Politics & Governance
What will be the closing value of the euro to US dollar exchange rate on 14 October 2022?,Economics & Business
"When will Fitch, Moody's, and/or S&P either announce that the US has defaulted on its debt and/or downgrade the long-term credit rating of the US?",Economics & Business
"Between the weeks ending 2 September 2023 and 30 March 2024, what will be the highest weekly number of COVID-19 new hospital admissions in the US?",Healthcare & Biology
"Between 12 June 2020 and 31 August 2020, what will be the highest number of COVID-19 Hospitalizations in the state of Texas for a single day?",Healthcare & Biology
"How many total major hurricanes (Category 3 or higher) will occur in the Atlantic Ocean in the 2021 hurricane season, according to the National Hurricane Center?",Science & Tech
