question,category
What is the Interest for personal mana loans?,Economics & Business
Will Taika Waititi's Star Wars film come out before Grand Theft Auto 6?,Arts & Recreation
Will 2024 be the hottest year in the last 25 years,Science & Tech
"Will Nostr reach 30,000 monthly active users in 2024?",Science & Tech
Will the S&P 500 reach a new all-time high in 2024?,Economics & Business
Will I reach a 365 day streak with no forgiveness?,Arts & Recreation
Will Carlos Alcaraz win a major championship in 2024?,Sports
Will two chess masters settle their cheating disputes through a match in 2024?,Sports
"Will I, Daniel Gallant, Finish 2023 in 1st place on the bronze leaderboard?",Sports
Will Donald Trump host a New Year's party?,Politics & Governance
Will Manifold have a Merry Christmas?🎄,Arts & Recreation
Will Joe Biden overturn trade commission ruling to keep Apple Watch Series 9 on the shelves?,Politics & Governance
Will China real GDP growth rate reach 5% in 2024?,Economics & Business
Will I hit a 200 kg squat on my next powerlifting meet in Q2 2024?,Sports
Will there be a non-natural origin theory for the next pandemic?,Healthcare & Biology
Will Marianne Williamson win more than 7 delegates in the 2024 presidential primaries?,Politics & Governance
Will i go to the gym tomorrow(26th dec),Arts & Recreation
"Will it snow in St. John's, NL on December 31st?",Science & Tech
Will it snow in New York during the winter of 2023-2024?,Science & Tech
6) An alternative to the transformer architecture will see meaningful adoption.,Science & Tech
Will Bitcoin reach over 44k today? 12/25,Economics & Business
Will it snow in Toronto on December 30th?,Science & Tech
Will non-human intelligence be confirmed before artificial general intelligence?,Science & Tech
Will there be a united Ireland by 2034?,Politics & Governance
"In 2028, will democrats have a major presidential candidate from the centrist wing of the party?",Politics & Governance
8) The Microsoft/OpenAI relationship will begin to fray.,Science & Tech
Will Destiny talk to DJ Akademiks in 2024?,Arts & Recreation
5) A number of Fortune 500 companies will create a new C-suite position: Chief AI Officer.,Economics & Business
"Will it snow in St. John's, NL on December 30th?",Science & Tech
7) Strategic investments from cloud providers into AI startups [...] will be challenged by regulators.,Economics & Business
"Will a bitcoin cycle top occur around January 10, 2024?",Economics & Business
10) U.S. court rule that generative AI models trained on the internet represent a violation of copyright. [Abbreviated],Science & Tech
9) Some of the hype and herd mentality behavior that shifted from crypto to AI in 2023 will shift back to crypto in 2024,Economics & Business
Will an LLM Built on a State Space Model Architecture Have Been SOTA at any Point before EOY 2027? [READ DESCRIPTION],Science & Tech
Will Ian Nepomniachtchi ever become World Chess Champion,Sports
Will Earth have a Space Elevator before 2055?,Science & Tech
4) The most advanced closed models will continue to outperform the most advanced open models by a meaningful margin.,Science & Tech
3) The terms “large language model” and “LLM” will become less common.,Science & Tech
Will there be a crewed mission to Mars before 2035?,Science & Tech
Will Trudeau still be prime minister by the end of 2024,Politics & Governance
2) Stability AI will shut down.,Science & Tech
1) Nvidia will dramatically ramp up its efforts to become a cloud provider.,Science & Tech
Will 12 or more users request a loan from me by 22 January 2024?,Economics & Business
Set and get my burpee goal this week?,Sports
Will NVIDIA stock go up or down in 2023?,Economics & Business
Will I get my Apple Watch Move Ring at least 5/7 days this week?,Arts & Recreation
Will 'Aquaman and the Lost Kingdom' (2023) be rated at least 6.0 on IMDb one week after its U.S. release?,Arts & Recreation
Will the S&P 500 offer a REAL CAGR greater than 8% from 2024 until 2050?,Economics & Business
Will the PS5 outsell the PSP by the end of 2024?,Arts & Recreation
Will Argentina's poverty level drop below 15% by 2030?,Economics & Business
Will Russia control Krynky by the end of January 2024,Politics & Governance
Will the 2024 Google Santa Tracker use the same route that it has since 2019?,Science & Tech
Will I (co-)start a new coliving community in 2024?,Economics & Business
Will John von Neumann's grave be exhumed (for his DNA) by EOY 2033?,Science & Tech
Will I have a green card by EOY 2024?,Politics & Governance
Will MrBeast be the most subscribed YouTube channel on December 31st 2024?,Arts & Recreation
"By 2024-10-01, will ChatGPT Plus users be able to generate >=10 seconds of video?",Science & Tech
Will the Paris Olympics opening ceremony take place on the Seine river per the initial plan?,Sports
Will GTA VI's Metacritic Metascore be Higher than 95 after 2 weeks of the game being out?,Arts & Recreation
San Francisco Prop A (affordable housing bond) passes 2024-03-05,Politics & Governance
Will undocumented immigrants be able to vote for president in any state in the US by the end of 2025?,Politics & Governance
"In 2024, will METR or Google announce the results of a METR eval on a Google LLM?",Science & Tech
Will Aleksandar Vučić be the President of Serbia on 1 July 2024?,Politics & Governance
"By 2040, will Alessandro Moreschi stop being the last castrato?",Arts & Recreation
Will I go to the gym twice a week in January? ($150M sub),Arts & Recreation
Will Boston get less than 25 inches of snow for the entire winter of 2023-2024,Science & Tech
Will Sid Mani (ftlsid.com) win an Emergent Ventures fellowship by EOY 2025?,Economics & Business
Price Deflation at any point in 2024?,Economics & Business
Will unemployment be at least 7% in November 2024?,Economics & Business
Will a meteorite cause property damage or injury on Earth in 2024?,Science & Tech
"Will dialogue for Civ7 be dynamically generated, rather than hard-coded in?",Science & Tech
Will Anthony D'Esposito be reelected in 2024?,Politics & Governance
Will Manifold fix loans in H1 2024?,Economics & Business
"Will Michael Reeves upload before April 11, 2024?",Arts & Recreation
Will this market resolve at 55% or higher by the end of March 31?,Economics & Business
Peter Daszak dies in suspicious circumstances  by mid 2027,Politics & Governance
Will Solana token more than $130 by end of 2023 by CoinGecko,Economics & Business
Will the Eagles win against the Giants on 12/25?,Sports
Will Claudine Gay remain Harvard’s president until the end of 2023?,Politics & Governance
Will Nikki Haley win more than 50% of the vote in any GOP primary?,Politics & Governance
Will Grand Theft Auto 6 release before Monster Hunter Wilds?,Arts & Recreation
Will Tawanchai remain featherweight Muay Thai champion of ONE by the end of 2024?,Sports
Will April 2024 be the hottest April on record?,Science & Tech
Will Belal Muhammad be the next one to fight for the Welter Weight title?,Sports
Will anyone from the Likud desert by the end of 2024?,Politics & Governance
Will Nico Carrillo be bantamweight Muay Thai champion of ONE by the end of 2024?,Sports
"Of the companies which are currently #11-20 in market cap, will any be larger than Eli Lilly (#10) at the end of 2024?",Economics & Business
"Will Stability.ai go under by May 1st, 2024?",Economics & Business
Will the war in Israel end after the entirety of the Gaza strip is occupied?,Politics & Governance
Will the Winds of Winter Prologe be set in the Riverlands?,Arts & Recreation
Will Scott Boland be picked in the Australian XI to play against Pakistan for the upcoming Boxing Day Cricket Match?,Sports
Will manifold increase the cost of market creation before 2025?,Economics & Business
"Is it possible to ""hack"" an average human into performing arbitrary behaviors?",Healthcare & Biology
Will a human walk on the moon again before Star Citizen releases?,Science & Tech
Will the Bridges podcast have Ethan Klein as a guest in 2024?,Arts & Recreation
"If a large, good survey of AI engineers in the United States is run, what will be the average p(doom) within 10 years?",Science & Tech
"If I write an e/acc FAQ, will it be widely shared?",Economics & Business
Will my family finish Die Hard?,Arts & Recreation
Will Ben-Gvir quit Netanyahu's government by the end of 2024?,Politics & Governance
"Will there be a major AAA video game where NPCs speak with dynamically generated, rather than fixed dialogue, in 2024",Science & Tech
Will Earth have a Space Elevator before 2050?,Science & Tech
Will Bryan Johnson get Magnetic resonance elastography (MRE) of his brain in 2024?,Healthcare & Biology
Should you infer in the lottery sniper problem that you're only one of many players?,Economics & Business
Will there be a crewed mission to Mars before 2050?,Science & Tech
Will the creator of this market (me) be here to resolve it on December 31st 2025?,Economics & Business
"Will ""NPCs"" in GTA 7 have ""fixed dialogue lines""?",Arts & Recreation
"Will I give birth before the new year, 2024?",Healthcare & Biology
Will the 2024 AIME get leaked?,Education & Research
Will Death Stranding 2 release before Kingdom Hearts IV?,Arts & Recreation
Will the Obamas start a video game production company before 2026?,Economics & Business
jstlk stock permanent,Economics & Business
Will Walter White or a different character from Breaking Bad be playable in Multiversus before February 15th 2025?,Arts & Recreation
Will Sweden Join NATO before Death Stranding 2 releases?,Politics & Governance
Will Haunted Chocolatier (Stardew Valley Dev's next game) release before Jan 1st 2025?,Arts & Recreation
Will Jimmy Carter be the #1 most nominated person for Derby Dead Pool 2024?,Sports
Will the US defeat China in war before 2028?,Security & Defenses
Will Sam Howell be the starting QB for the Washington Commanders at the beginning of the 2024 season?,Sports
"Will cerebrolysin be shown to improve memory, intelligence, or some other trait?",Healthcare & Biology
"Will one of the Big Four airlines go bankrupt, be acquired, or cease operations before EOY 2026?",Economics & Business
Will the next iPhone (2024) be round?,Science & Tech
Will a new version of the X-Files TV show air by September 2025?,Arts & Recreation
Will Seattle United B12 Tango win their soccer game on Jan. 21st against Three Rivers?,Sports
"🟢 Is ETH ( Ethereum ) the calm before the storm, preparing to explode in 2024?",Economics & Business
Will the 14th Amendment to the US Constitution be altered or repealed before 2028?,Politics & Governance
Will Skibidi Toilet reach 100 full episodes (by the creator's numbering) by EOY 2024?,Arts & Recreation
Will Manifold significantly improve discovery in 2024? (resolves based on a poll),Science & Tech
Will any model in Apple’s 2024 MacBook lineup include an on-device LLM “ChatBot”?,Science & Tech
"If Tetraspace makes an assurance contract website in 2024, will it reach 100 users?",Economics & Business
Will Google next Pixel Phone (2024) include an on-device LLM “ChatBot”?,Science & Tech
Vote no,Politics & Governance
Will the next Millennium Problem be solved by an AI?,Science & Tech
Will Apple’s next iPhone (2024) include an on-device LLM “ChatBot”?,Science & Tech
Will Manifold try to create a sitewide event before Pi Day? [~Person of The Year Retrospective],Arts & Recreation
"Will a state, province, or country issue a public health warning or laws about AI companions in 2024?",Politics & Governance
Will Sweden Join NATO before Bitcoin reaches $50K again?,Politics & Governance
"Will I get stuck on the way to the beach and back during Christmas because of protests in Lima, Perú",Politics & Governance
Will stranger things end in the next season?,Arts & Recreation
Will anyone bet on my question before EOY 2023?,Economics & Business
Will the release of Gemini Ultra trigger a surge of public panic and government concern around AI?,Science & Tech
Will Spain lose any territory before 01/01/2030? (Either land or territorial waters),Politics & Governance
will minecraft's movie come out in 2025,Arts & Recreation
Will my girlfriend's cat utterly DESTROY her mom's Christmas tree while we're away on vacation?,Arts & Recreation
"Will Enve Composites release their integrated bar/stem before January 31,2024?",Economics & Business
Will @Mira apologize for how they went bankrupt?,Economics & Business
Will there be a shortage of IT workers by the end of 2030?,Science & Tech
"Will X (fka Twitter) come public in 2024 under the ""X"" stock ticker?",Economics & Business
"Will Alby Browser Extension hit 1,000⭐ stars on Github in 2024?",Science & Tech
Will Australian Open 2024 have a new grand slam champion on the women's side?,Sports
Will flight AF 1180 from Paris to London departing on 2023-12-27 arrive with 30+ minute delay (YES),Economics & Business
Will at least one American woman reach the singles final of Australian Open 2024?,Sports
"Will Adrian Orr, governor of the reserve Bank of New Zealand, serve out the entire remainder of his term?",Economics & Business
Will a cure that eradicated over 50% of cancer tumors without significant adverse side effects be found before 2050?,Healthcare & Biology
Will flight AF 1180 from Paris to London departing on 2023-12-25 arrive with 30+ minute delay (YES),Economics & Business
Will I be Ṁ Bankrupt by end of Q1 2024…,Economics & Business
Will Google Santa Tracker's Santa make a turn greater than 90˚?,Science & Tech
Will flight AF 1146 from Paris to Warsaw departing on 2023-12-27 arrive with 30+ minute delay (YES),Economics & Business
Will flight AF 1580 from Paris to London departing on 2023-12-26 arrive with 30+ minute delay (YES),Economics & Business
Will flight LO 331 from Warsaw to Paris departing on 2023-12-25 arrive with 30+ minute delay (YES),Economics & Business
Will flight AF 1146 from Paris to Warsaw departing on 2023-12-26 arrive with 30+ minute delay (YES),Economics & Business
Will flight AF 1580 from Paris to London departing on 2023-12-27 arrive with 30+ minute delay (YES),Economics & Business
Will flight LO 331 from Warsaw to Paris departing on 2023-12-26 arrive with 30+ minute delay (YES),Economics & Business
Will hollow knight: silksong release before march 1 2024?,Arts & Recreation
Will flight AF 334 from Paris to Boston departing on 2023-12-26 arrive with 30+ minute delay (YES),Economics & Business
Will flight AF 333 from Boston to Paris departing on 2023-12-25 arrive with 30+ minute delay (YES),Economics & Business
Will flight DL 224 from Boston to Paris departing on 2023-12-26 arrive with 30+ minute delay (YES),Economics & Business
Will I get into college,Education & Research
Will Tal Broda be fired or demoted from OpenAI due to his now deleted posts from Twitter/X?,Economics & Business
[Daily] Will GOOG close higher on December 21 than it closed on December 20?,Economics & Business
Will voting on polls show up in the live feed on manifold before Feb 2024?,Politics & Governance
Will Manifold introduce an AI-based feature that automatically resolves markets in 2024?,Science & Tech
Will I attend ASPR/WARP in 2024?,Healthcare & Biology
[Daily] Will AMZN close higher on December 21 than it closed on December 20?,Economics & Business
Will the USA top 1% total common wealth become less than all the wealth in the Middle Class again at the end of 2024?,Economics & Business
[Daily] Will Lockheed Martin LMT close higher on December 21 than it closed on December 20?,Economics & Business
"If I am revived from cryopreservation, will it be bad for me?",Healthcare & Biology
🇫🇷 📖  Will French National Assembly vote for a new immigration law tonight?,Politics & Governance
[Daily] Will AAPL close higher on December 21 than it closed on December 20?,Economics & Business
[Daily] Will NVDA close higher on December 21 than it closed on December 20?,Economics & Business
Will CLEAR's biometric customer data be leaked by 2027?,Security & Defenses
Will the Bitcoin sidechains have more TVL than all other alts by the end of 2024?,Economics & Business
Will the ice caps be bigger in July 2024 than July 2023?,Science & Tech
Will Clarence Thomas rule with the Majority on Jack Smith's Supreme Court petition to see if Donald Trump has immunity?,Politics & Governance
Will Cori Bush win re-election to the House in 2024,Politics & Governance
Will the International Seabed Authority issue a deep sea mining (exploitation) license before 2026?,Politics & Governance
Will a new Rachet and Clank game release in 2029 like the Insomniac Games leak claims?,Arts & Recreation
Will Destiny cry on stream before 2025,Arts & Recreation
[Daily] Will AAPL close higher on December 20 than it closed on December 19?,Economics & Business
[Daily] Will Lockheed Martin LMT close higher on December 20 than it closed on December 19?,Economics & Business
[Daily] Will NVDA close higher on December 20 than it closed on December 19?,Economics & Business
Will FIDE rate Firouzja’s mini-matches “Race to Candidates” tournament?,Sports
[Daily] Will GOOG close higher on December 20 than it closed on December 19?,Economics & Business
Will the 2024 presidential election result be disputed?,Politics & Governance
[Daily] Will AMZN close higher on December 20 than it closed on December 19?,Economics & Business
Will Arc Browser on Windows be released to more than 1000 betatesters in 2023?,Science & Tech
Will statement expressions become part of the official ISO C Standard before 2028?,Science & Tech
Will xAI be the first to release AGI to the public?,Science & Tech
[Daily] Will MSFT close higher on December 20 than it closed on December 19?,Economics & Business
Will Sam Altman be the CEO of OpenAI when it releases AGI?,Science & Tech
"How much physics have we discovered, of all there is to discover?",Science & Tech
will at least 177 high-profile names of Epstein's associates become publicly available by the end of Feb '24?,Politics & Governance
"Will Manifold add a Loan Overview feature before July 1st, 2024?",Science & Tech
Will Recep Tayyip Erdogan stop being the leader of Turkey before Vladimir Putin stops being the leader of Russia?,Politics & Governance
Will the S&P 500 (INDEXSP:.INX) close higher on Fri. January 5th than it closed on Fri. December 29th? {WEEKLY},Economics & Business
Will Recep Tayyip Erdogan stop being the leader of Turkey before Xi Jinping stops being the leader of China?,Politics & Governance
"Will the decade from 2020 through the end of 2029 become known as the ""Warring Twenties""?",Politics & Governance
Will paintings by Mark Rothko fetch more than $250mm combined at auction during 2024?,Arts & Recreation
Stock Market: Will the S&P 500 index trade above 4800 during 2023?,Economics & Business
Will The S&P 500 (INDEXSP: .INX) From 2pm-4pm Move Higher On Fri. January 5th? {DAILY},Economics & Business
Will The S&P 500 (INDEXSP: .INX) From 2pm-4pm Move Higher On Thu. January 4th? {DAILY},Economics & Business
Will Rick and Morty's Justin Roiland return to produce the show before February 2024?,Arts & Recreation
Will Rick and Morty's Justin Roiland return to produce the show before February 2024?,Arts & Recreation
Will The S&P 500 (INDEXSP: .INX) From 2pm-4pm Move Higher On Wed. January 3rd? {DAILY},Economics & Business
Will the UK's FTSE 100 close higher on 20th December than it closed on 19th December?,Economics & Business
Will The S&P 500 (INDEXSP: .INX) From 2pm-4pm Move Higher On Tue. January 2nd? {DAILY},Economics & Business
I am about to speedrun Celeste any%. Will I get a sub 45?,Sports
Will auctions at Christie's fetch more than $6.2B total in 2024?,Economics & Business
Will the iShares Semiconductor ETF (NASDAQ: SOXX) close higher on Tue. December 19th than on Mon. December 18th? {DAILY},Economics & Business
[Daily] Will AMZN close higher on December 19 than it closed on December 18?,Economics & Business
[Daily] Will AAPL close higher on December 19 than it closed on December 18?,Economics & Business
[Daily] Will GOOG close higher on December 19 than it closed on December 18?,Economics & Business
[Daily] Will MSFT close higher on December 19 than it closed on December 18?,Economics & Business
[Daily] Will NVDA close higher on December 19 than it closed on December 18?,Economics & Business
GPT4-Resolving:   Will there be more than 325 markets created on manifold in the last 24 hours?,Economics & Business
Efficient full homomorphic encryption for frontier model training by 2030?,Science & Tech
Will there be a crewed mission to Venus before 2070?,Science & Tech
Will there be a crewed mission to Jupiter before 2045?,Science & Tech
Will there be a Dyson Sphere around the Sun before 2090?,Science & Tech
Will we get AGI before July 1st 2026?,Science & Tech
Will Xi Jinping be the leader of China at the end of 2026?,Politics & Governance
[Daily] Will Lockheed Martin LMT close higher on December 19 than it closed on December 18,Economics & Business
Will HuggingFace be acquired by Meta by end of 2024?,Economics & Business
Did the St. Louis police actually crash their car into an LGBT bar and then arrest the owner for being upset about this?,Politics & Governance
Will Kim Jong Un be the leader of North Korea at the end of 2026?,Politics & Governance
Will there be a crewed mission to Saturn before 2045?,Science & Tech
Will a laser lift a payload to space before 2045?,Science & Tech
Will Jutta Leerdam win the 1000m speedskating (Ladies) on the Dutch Distances Championships on the 30th of December 2023,Sports
Will Kjeld Nuis win the 1000m speedskating (men) on the Dutch Distances Championships on the 30th of December 2023?,Sports
Will the Vegas Golden Knights beat Carolina Hurricanes on December 19?,Sports
"Will a third game in the ""AI: The Somnium Files"" series be announced by the end of 2024?",Arts & Recreation
Will amazon reach an ATH in 2024 ?,Economics & Business
Will the St. Louis Blues beat Tampa Bay Lightning on December 19?,Sports
Will Deltarune have exactly one ending?,Arts & Recreation
"Will an LLM be integrated into a major smart assistant (i.e., Google, Siri, Alexa, Bixby) before the end of 2024?",Science & Tech
[Metaculus] Will Ukraine sever the land bridge between Crimea and Russia before 2025?,Politics & Governance
"Will Manifold be fast to use on mobile (Android) by Feb 15, 2024?",Science & Tech
Will alphabet reach an ATH in 2024 ?,Economics & Business
Israel will begin paying Jews from around the world to move into Gaza by May 2024?,Politics & Governance
Will Grand Theft Auto V reach a new all-time peak player count on SteamCharts before 2025?,Arts & Recreation
Will there be a nuclear war before 2100?,Security & Defenses
Did the DEFUSE project cause the COVID-19 pandemic?,Science & Tech
Will the Edmonton Oilers beat New York Islanders on December 19?,Sports
NFL Week 16 (Dec 25): Will the San Francisco 49ers win by more than 5.5 points against the Baltimore Ravens?,Sports
Will the Toronto Maple Leafs  beat New York Rangers on December 19?,Sports
Will the Goldbach conjecture be found unprovable before 2030?,Science & Tech
Will Carti drop the album Music in January 2024,Arts & Recreation
Will Tempur-Pedic change their logo to reduce the butt again by World Sleep Day 2029? (March 15th),Economics & Business
Will Michigan QB JJ McCarthy return to college football for another season?,Sports
Will Indonesia move their capital from Jakarta to Nusantara on August 17th 2024 as planned?,Politics & Governance
Will Betelgeuse go supernova before 2100?,Science & Tech
Could AI research see a shift in focus soon?,Science & Tech
"Will there be another country to accept Bitcoin as legal tender until end of 2024, except El Salvador?",Economics & Business
Will chat gpt 5 be released before 2025,Science & Tech
Will I promote to Masters this league?,Sports
🏀 2023 NCAAM: Will #22 Virginia beat #23 Memphis?,Sports
Will any officer be found guilty for the death of Manuel Ellis?,Politics & Governance
"If a player casts Dress Down with Opalescence in play, will they get the ETB trigger to draw a card?",Arts & Recreation
will I top the gold league at the end of the year?,Sports
Will Manifold give out more loans leading up to New Year's 2024?,Economics & Business
🏀 2023 NCAAM: Will #6 Marquette beat Providence?,Sports
Will Humanity deploy any new technology in an unsafe way by 2030? (Contra LeCun),Science & Tech
Will Walmart close higher Dec 26 than Dec 19? (WMT Weekly),Economics & Business
Will Target close higher Dec 26 than Dec 19? (TGT Weekly),Economics & Business
Was 9/11 an inside job?,Politics & Governance
Will Walgreens close higher Dec 26 than Dec 19? (WBA Weekly),Economics & Business
Will Etched.AI launch a transformer chip product before 2025?,Science & Tech
Nippon Steel acquires US Steel?,Economics & Business
Will Dollar General close higher Dec 26 than Dec 19? (DG Weekly),Economics & Business
"Will my video ""The Year Without Reindeer"" get over 100 views on YouTube by the end of Christmas Day?",Arts & Recreation
Will single-egress be legalized in Canada this year?,Politics & Governance
Is there a number of repetitions for which the Miller-Rabin primality test might succeed on all numbers?,Science & Tech
Will Costco close higher Dec 26 than Dec 19? (COST Weekly),Economics & Business
Was JFK shot by one of the men in the front seats of the car?,Politics & Governance
Is Chinas Economy Collapsing ?,Economics & Business
[Weekly] Will Lockheed Martin LMT close higher on December 22 than it did on December 18?,Economics & Business
Will Tom Holland and Zendaya break up before 2035?,Arts & Recreation
Will Tom Holland and Zendaya get married before 2035?,Arts & Recreation
